drop table if exists t1;
create table t1 (a int, key (a));
insert into t1 values (NULL), (0), (1), (2), (3), (4), (5), (6), (7), (8), (9),
(10), (11), (12), (13), (14), (15), (16), (17), (18), (19);
select * from t1 where not(not(not(a > 10)));
a
0
1
2
3
4
5
6
7
8
9
10
select * from t1 where not(not(not(a < 5) and not(a > 10)));
a
5
6
7
8
9
10
select * from t1 where not(a = 10);
a
0
1
2
3
4
5
6
7
8
9
11
12
13
14
15
16
17
18
19
select * from t1 where not(a != 1);
a
1
select * from t1 where not(a < 10);
a
10
11
12
13
14
15
16
17
18
19
select * from t1 where not(a >= 10);
a
0
1
2
3
4
5
6
7
8
9
select * from t1 where not(a > 10);
a
0
1
2
3
4
5
6
7
8
9
10
select * from t1 where not(a <= 10);
a
11
12
13
14
15
16
17
18
19
select * from t1 where not(a is null);
a
0
1
2
3
4
5
6
7
8
9
10
11
12
13
14
15
16
17
18
19
select * from t1 where not(a is not null);
a
NULL
select * from t1 where not(a < 5 or a > 15);
a
5
6
7
8
9
10
11
12
13
14
15
select * from t1 where not(a < 15 and a > 5);
a
0
1
2
3
4
5
15
16
17
18
19
select * from t1 where a = 2 or not(a < 10);
a
2
10
11
12
13
14
15
16
17
18
19
select * from t1 where a > 5 and not(a > 10);
a
6
7
8
9
10
select * from t1 where a > 5 xor a < 10;
a
0
1
2
3
4
5
10
11
12
13
14
15
16
17
18
19
select * from t1 where a = 2 or not(a < 5 or a > 15);
a
2
5
6
7
8
9
10
11
12
13
14
15
select * from t1 where a = 7 or not(a < 15 and a > 5);
a
0
1
2
3
4
5
7
15
16
17
18
19
select * from t1 where NULL or not(a < 15 and a > 5);
a
0
1
2
3
4
5
15
16
17
18
19
select * from t1 where not(NULL and a > 5);
a
0
1
2
3
4
5
select * from t1 where not(NULL or a);
a
select * from t1 where not(NULL and a);
a
0
select * from t1 where not((a < 5 or a < 10) and (not(a > 16) or a > 17));
a
10
11
12
13
14
15
16
17
18
19
select * from t1 where not((a < 5 and a < 10) and (not(a > 16) or a > 17));
a
5
6
7
8
9
10
11
12
13
14
15
16
17
18
19
select * from t1 where ((a between 5 and 15) and (not(a like 10)));
a
5
6
7
8
9
11
12
13
14
15
# XOR (Note: XOR is negated by negating one of the operands)
# Should return 6,7
SELECT * FROM t1 WHERE ((a > 5) XOR (a > 7));
a
6
7
# Should return 0..5,8..19
SELECT * FROM t1 WHERE ((NOT (a > 5)) XOR (a > 7));
a
0
1
2
3
4
5
8
9
10
11
12
13
14
15
16
17
18
19
SELECT * FROM t1 WHERE ((a > 5) XOR (NOT (a > 7)));
a
0
1
2
3
4
5
8
9
10
11
12
13
14
15
16
17
18
19
SELECT * FROM t1 WHERE NOT ((a > 5) XOR (a > 7));
a
0
1
2
3
4
5
8
9
10
11
12
13
14
15
16
17
18
19
# Should return 6,7
SELECT * FROM t1 WHERE NOT ((NOT (a > 5)) XOR (a > 7));
a
6
7
SELECT * FROM t1 WHERE NOT ((a > 5) XOR (NOT (a > 7)));
a
6
7
# Should return 0..5,8..19
SELECT * FROM t1 WHERE NOT ((NOT (a > 5)) XOR (NOT (a > 7)));
a
0
1
2
3
4
5
8
9
10
11
12
13
14
15
16
17
18
19
# Should have empty result
SELECT * FROM t1 WHERE (NULL XOR (a > 7));
a
SELECT * FROM t1 WHERE NOT (NULL XOR (a > 7));
a
# Should be simplified to "...WHERE (a XOR a)
# Should be simplified to "...WHERE (a XOR a)
# End XOR
delete from t1 where a > 3;
select a, not(not(a)) from t1;
a	not(not(a))
NULL	NULL
0	0
1	1
2	1
3	1
drop table t1;
