SET sql_mode = 'NO_ENGINE_SUBSTITUTION';
Warnings:
Warning	3090	Changing sql mode 'NO_AUTO_CREATE_USER' is deprecated. It will be removed in a future release.
create table t1 (first char(10),last char(10));
insert into t1 values ("Michael","Widenius");
insert into t1 values ("Allan","Larsson");
insert into t1 values ("David","Axmark");
select concat(first," ",last) as name from t1 order by name;
name
Allan Larsson
David Axmark
Michael Widenius
select concat(last," ",first) as name from t1 order by name;
name
Axmark David
Larsson Allan
Widenius Michael
drop table t1;
create table t1 (i int);
insert into t1 values(1),(2),(1),(2),(1),(2),(3);
select distinct i from t1;
i
1
2
3
select distinct i from t1 order by rand(5);
i
1
3
2
select distinct i from t1 order by i desc;
i
3
2
1
select distinct i from t1 order by 1-i;
i
3
2
1
select distinct i from t1 order by mod(i,2),i;
i
2
1
3
drop table t1;
create table t1 ( pk     int primary key, name   varchar(255) not null, number varchar(255) not null);
insert into t1 values (1, 'Gamma',     '123'), (2, 'Gamma Ext', '123a'), (3, 'Alpha',     '001'), (4, 'Beta',      '200c');
select distinct t1.name as 'Building Name',t1.number as 'Building Number' from t1 order by t1.name asc;
Building Name	Building Number
Alpha	001
Beta	200c
Gamma	123
Gamma Ext	123a
drop table t1;
create table t1 (id int not null,col1 int not null,col2 int not null,index(col1));
insert into t1 values(1,2,2),(2,2,1),(3,1,2),(4,1,1),(5,1,4),(6,2,3),(7,3,1),(8,2,4);
select * from t1 order by col1,col2;
id	col1	col2
4	1	1
3	1	2
5	1	4
2	2	1
1	2	2
6	2	3
8	2	4
7	3	1
select col1 from t1 order by id;
col1
2
2
1
1
1
2
3
2
select col1 as id from t1 order by id;
id
1
1
1
2
2
2
2
3
select concat(col1) as id from t1 order by id;
id
1
1
1
2
2
2
2
3
drop table t1;
CREATE TABLE t1
(
a          int unsigned       NOT NULL,
b          int unsigned       NOT NULL,
c          int unsigned       NOT NULL,
UNIQUE(a),
INDEX(b),
INDEX(c)
);
CREATE TABLE t2
(
c          int unsigned       NOT NULL,
i          int unsigned       NOT NULL,
INDEX(c)
);
CREATE TABLE t3
(
c          int unsigned       NOT NULL,
v          varchar(64),
INDEX(c)
);
INSERT INTO t1 VALUES (1,1,1);
INSERT INTO t1 VALUES (2,1,2);
INSERT INTO t1 VALUES (3,2,1);
INSERT INTO t1 VALUES (4,2,2);
INSERT INTO t2 VALUES (1,50);
INSERT INTO t2 VALUES (2,25);
INSERT INTO t3 VALUES (1,'123 Park Place');
INSERT INTO t3 VALUES (2,'453 Boardwalk');
SELECT    a,b,if(b = 1,i,if(b = 2,v,''))
FROM      t1
LEFT JOIN t2 USING(c)
LEFT JOIN t3 ON t3.c = t1.c;
a	b	if(b = 1,i,if(b = 2,v,''))
1	1	50
3	2	123 Park Place
2	1	25
4	2	453 Boardwalk
SELECT    a,b,if(b = 1,i,if(b = 2,v,''))
FROM      t1
LEFT JOIN t2 ON t1.c = t2.c
LEFT JOIN t3 ON t3.c = t1.c;
a	b	if(b = 1,i,if(b = 2,v,''))
1	1	50
3	2	123 Park Place
2	1	25
4	2	453 Boardwalk
SELECT    a,b,if(b = 1,i,if(b = 2,v,''))
FROM      t1
LEFT JOIN t2 USING(c)
LEFT JOIN t3 ON t3.c = t1.c
ORDER BY a;
a	b	if(b = 1,i,if(b = 2,v,''))
1	1	50
2	1	25
3	2	123 Park Place
4	2	453 Boardwalk
SELECT    a,b,if(b = 1,i,if(b = 2,v,''))
FROM      t1
LEFT JOIN t2 ON t1.c = t2.c
LEFT JOIN t3 ON t3.c = t1.c
ORDER BY a;
a	b	if(b = 1,i,if(b = 2,v,''))
1	1	50
2	1	25
3	2	123 Park Place
4	2	453 Boardwalk
drop table t1,t2,t3;
create table t1 (ID int not null primary key, TransactionID int not null);
insert into t1 (ID, TransactionID) values  (1,  87), (2,  89), (3,  92), (4,  94), (5,  486), (6,  490), (7,  753), (9,  828), (10, 832), (11, 834), (12, 840);
create table t2 (ID int not null primary key, GroupID int not null);
insert into t2 (ID, GroupID) values (87,  87), (89,  89), (92,  92), (94,  94), (486, 486), (490, 490),(753, 753), (828, 828), (832, 832), (834, 834), (840, 840);
create table t3 (ID int not null primary key, DateOfAction date not null);
insert into t3 (ID, DateOfAction) values  (87,  '1999-07-19'), (89,  '1999-07-19'), (92,  '1999-07-19'), (94,  '1999-07-19'), (486, '1999-07-18'), (490, '2000-03-27'), (753, '2000-03-28'), (828, '1999-07-27'), (832, '1999-07-27'),(834, '1999-07-27'), (840, '1999-07-27');
select t3.DateOfAction, t1.TransactionID from t1 join t2 join t3 where t2.ID = t1.TransactionID and t3.ID = t2.GroupID order by t3.DateOfAction, t1.TransactionID;
DateOfAction	TransactionID
1999-07-18	486
1999-07-19	87
1999-07-19	89
1999-07-19	92
1999-07-19	94
1999-07-27	828
1999-07-27	832
1999-07-27	834
1999-07-27	840
2000-03-27	490
2000-03-28	753
select t3.DateOfAction, t1.TransactionID from t1 join t2 join t3 where t2.ID = t1.TransactionID and t3.ID = t2.GroupID order by t1.TransactionID,t3.DateOfAction;
DateOfAction	TransactionID
1999-07-19	87
1999-07-19	89
1999-07-19	92
1999-07-19	94
1999-07-18	486
2000-03-27	490
2000-03-28	753
1999-07-27	828
1999-07-27	832
1999-07-27	834
1999-07-27	840
drop table t1,t2,t3;
create table t1 (a int not null, b int, c varchar(10), key (a, b, c));
insert into t1 values (1, NULL, NULL), (1, NULL, 'b'), (1, 1, NULL), (1, 1, 'b'), (1, 1, 'b'), (2, 1, 'a'), (2, 1, 'b'), (2, 2, 'a'), (2, 2, 'b'), (2, 3, 'c'),(1,3,'b');
select * from t1 where (a = 1 and b is null and c = 'b') or (a > 2) order by a desc;
a	b	c
1	NULL	b
select * from t1 where a >= 1 and a < 3 order by a desc;
a	b	c
2	1	a
2	1	b
2	2	a
2	2	b
2	3	c
1	NULL	NULL
1	NULL	b
1	1	NULL
1	1	b
1	1	b
1	3	b
select * from t1 where a = 1 order by a desc, b desc;
a	b	c
1	3	b
1	1	NULL
1	1	b
1	1	b
1	NULL	NULL
1	NULL	b
select * from t1 where a = 1 and b is null order by a desc, b desc;
a	b	c
1	NULL	NULL
1	NULL	b
select * from t1 where a = 1 order by b desc;
a	b	c
1	3	b
1	1	NULL
1	1	b
1	1	b
1	NULL	NULL
1	NULL	b
drop table t1;
CREATE TABLE t1 (a int, b int);
INSERT INTO t1 VALUES (1, 2);
INSERT INTO t1 VALUES (3, 4);
INSERT INTO t1 VALUES (5, NULL);
SELECT * FROM t1 ORDER BY b;
a	b
5	NULL
1	2
3	4
SELECT * FROM t1 ORDER BY b DESC;
a	b
3	4
1	2
5	NULL
SELECT * FROM t1 ORDER BY (a + b);
a	b
5	NULL
1	2
3	4
SELECT * FROM t1 ORDER BY (a + b) DESC;
a	b
3	4
1	2
5	NULL
DROP TABLE t1;
CREATE TABLE t1 (
FieldKey varchar(36) NOT NULL default '',
LongVal bigint(20) default NULL,
StringVal mediumtext,
KEY FieldKey (FieldKey),
KEY LongField (FieldKey,LongVal),
KEY StringField (FieldKey,StringVal(32))
);
INSERT INTO t1 VALUES ('0',3,'0'),('0',2,'1'),('0',1,'2'),('1',2,'1'),('1',1,'3'), ('1',0,'2'),('2',3,'0'),('2',2,'1'),('2',1,'2'),('2',3,'0'),('2',2,'1'),('2',1,'2'),('3',2,'1'),('3',1,'2'),('3','3','3');
SELECT * FROM t1 WHERE FieldKey = '1' ORDER BY LongVal;
FieldKey	LongVal	StringVal
1	0	2
1	1	3
1	2	1
SELECT * FROM t1 WHERE FieldKey > '2' ORDER BY LongVal;
FieldKey	LongVal	StringVal
3	1	2
3	2	1
3	3	3
SELECT * FROM t1 WHERE FieldKey > '2' ORDER BY FieldKey, LongVal;
FieldKey	LongVal	StringVal
3	1	2
3	2	1
3	3	3
DROP TABLE t1;
CREATE TABLE t1 (a INT, b INT);
SET @id=0;
UPDATE t1 SET a=0 ORDER BY (a=@id), b;
DROP TABLE t1;
CREATE TABLE t1 (  id smallint(6) unsigned NOT NULL default '0',  menu tinyint(4) NOT NULL default '0',  KEY id (id),  KEY menu (menu)) ENGINE=SequoiaDB;
INSERT INTO t1 VALUES (11384, 2),(11392, 2);
SELECT id FROM t1 WHERE id <11984 AND menu =2 ORDER BY id DESC LIMIT 1 ;
id
11392
drop table t1;
create table t1(a int, b int, index(b));
insert into t1 values (2, 1), (1, 1), (4, NULL), (3, NULL), (6, 2), (5, 2);
select * from t1 where b=1 or b is null order by a;
a	b
1	1
2	1
3	NULL
4	NULL
select * from t1 where b=2 or b is null order by a;
a	b
3	NULL
4	NULL
5	2
6	2
drop table t1;
create table t1 (col1 int, col int);
create table t2 (col2 int, col int);
insert into t1 values (1,1),(2,2),(3,3);
insert into t2 values (1,3),(2,2),(3,1);
select t1.* , t2.col as t2_col from t1 left join t2 on (t1.col1=t2.col2)
order by col;
col1	col	t2_col
1	1	3
2	2	2
3	3	1
select col1 as col, col from t1 order by col;
ERROR 23000: Column 'col' in order clause is ambiguous
select t1.col as c1, t2.col as c2 from t1, t2 where t1.col1=t2.col2
order by col;
ERROR 23000: Column 'col' in order clause is ambiguous
select t1.col as c1, t2.col as c2 from t1, t2 where t1.col1=t2.col2
order by col;
ERROR 23000: Column 'col' in order clause is ambiguous
select col1 from t1, t2 where t1.col1=t2.col2 order by col;
ERROR 23000: Column 'col' in order clause is ambiguous
select t1.col as t1_col, t2.col2 from t1, t2 where t1.col1=t2.col2
order by col;
ERROR 23000: Column 'col' in order clause is ambiguous
select t1.col as t1_col, t2.col from t1, t2 where t1.col1=t2.col2
order by col;
t1_col	col
3	1
2	2
1	3
select col2 as c, col as c from t2 order by col;
c	c
3	1
2	2
1	3
select col2 as col, col as col2 from t2 order by col;
col	col2
1	3
2	2
3	1
select t2.col2, t2.col, t2.col from t2 order by col;
col2	col	col
3	1	1
2	2	2
1	3	3
select t2.col2 as col from t2 order by t2.col;
col
3
2
1
select t2.col2 as col, t2.col from t2 order by t2.col;
col	col
3	1
2	2
1	3
select t2.col2, t2.col, t2.col from t2 order by t2.col;
col2	col	col
3	1	1
2	2	2
1	3	3
drop table t1, t2;
create table t1 (a char(25));
insert into t1 set a = repeat('x', 20);
insert into t1 set a = concat(repeat('x', 19), 'z');
insert into t1 set a = concat(repeat('x', 19), 'ab');
insert into t1 set a = concat(repeat('x', 19), 'aa');
set max_sort_length=20;
select a from t1 order by a;
a
xxxxxxxxxxxxxxxxxxxab
xxxxxxxxxxxxxxxxxxxaa
xxxxxxxxxxxxxxxxxxxx
xxxxxxxxxxxxxxxxxxxz
drop table t1;
create table t1 (
`sid` decimal(8,0) default null,
`wnid` varchar(11) not null default '',
key `wnid14` (`wnid`(4))
#  key `wnid` (`wnid`) ## NOW SequoiaDB not support duplicate index
) engine=sequoiadb default charset=latin1;
insert into t1 (`sid`, `wnid`) values
('10100','01019000000'),('37986','01019000000'),('37987','01019010000'),
('39560','01019090000'),('37989','01019000000'),('37990','01019011000'),
('37991','01019011000'),('37992','01019019000'),('37993','01019030000'),
('37994','01019090000'),('475','02070000000'),('25253','02071100000'),
('25255','02071100000'),('25256','02071110000'),('25258','02071130000'),
('25259','02071190000'),('25260','02071200000'),('25261','02071210000'),
('25262','02071290000'),('25263','02071300000'),('25264','02071310000'),
('25265','02071310000'),('25266','02071320000'),('25267','02071320000'),
('25269','02071330000'),('25270','02071340000'),('25271','02071350000'),
('25272','02071360000'),('25273','02071370000'),('25281','02071391000'),
('25282','02071391000'),('25283','02071399000'),('25284','02071400000'),
('25285','02071410000'),('25286','02071410000'),('25287','02071420000'),
('25288','02071420000'),('25291','02071430000'),('25290','02071440000'),
('25292','02071450000'),('25293','02071460000'),('25294','02071470000'),
('25295','02071491000'),('25296','02071491000'),('25297','02071499000');
select * from t1 where wnid like '0101%' order by wnid;
sid	wnid
10100	01019000000
37986	01019000000
37989	01019000000
37987	01019010000
37990	01019011000
37991	01019011000
37992	01019019000
37993	01019030000
39560	01019090000
37994	01019090000
drop table t1;
CREATE TABLE t1 (a int);
INSERT INTO t1 VALUES (2), (1), (1), (2), (1);
SELECT a FROM t1 ORDER BY a;
a
1
1
1
2
2
(SELECT a FROM t1) ORDER BY a;
a
1
1
1
2
2
DROP TABLE t1;
CREATE TABLE t1 (a int, b int);
INSERT INTO t1 VALUES (1,30), (2,20), (1,10), (2,30), (1,20), (2,10);
(SELECT b,a FROM t1 ORDER BY a,b) ORDER BY b,a;
b	a
10	1
10	2
20	1
20	2
30	1
30	2
(SELECT b FROM t1 ORDER BY b DESC) ORDER BY b ASC;
b
10
10
20
20
30
30
(SELECT b,a FROM t1 ORDER BY b,a) ORDER BY a,b;
b	a
10	1
20	1
30	1
10	2
20	2
30	2
(SELECT b,a FROM t1 ORDER by b,a LIMIT 3) ORDER by a,b;
b	a
10	1
20	1
10	2
DROP TABLE t1;
CREATE TABLE t1 (a INT);
INSERT INTO t1 VALUES (1),(2);
SELECT a + 1 AS num FROM t1 ORDER BY 30 - num;
num
3
2
SELECT CONCAT('test', a) AS str FROM t1 ORDER BY UPPER(str);
str
test1
test2
SELECT a + 1 AS num FROM t1 GROUP BY 30 - num;
num
3
2
SELECT a + 1 AS num FROM t1 HAVING 30 - num;
num
2
3
SELECT a + 1 AS num, num + 1 FROM t1;
ERROR 42S22: Unknown column 'num' in 'field list'
SELECT a + 1 AS num, (select num + 2 FROM t1 LIMIT 1) FROM t1;
num	(select num + 2 FROM t1 LIMIT 1)
2	4
3	5
SELECT a.a + 1 AS num FROM t1 a JOIN t1 b ON num = b.a;
ERROR 42S22: Unknown column 'num' in 'on clause'
DROP TABLE t1;
CREATE TABLE t1 (a int);
SELECT p.a AS val, q.a AS val1 FROM t1 p, t1 q ORDER BY val > 1;
val	val1
SELECT p.a AS val, q.a AS val FROM t1 p, t1 q ORDER BY val;
ERROR 23000: Column 'val' in order clause is ambiguous
SELECT p.a AS val, q.a AS val FROM t1 p, t1 q ORDER BY val > 1;
ERROR 23000: Column 'val' in order clause is ambiguous
DROP TABLE t1;
CREATE TABLE t1 (a int);
INSERT INTO t1 VALUES (3), (2), (4), (1);
SELECT a, IF(a IN (2,3), a, a+10) FROM t1
ORDER BY IF(a IN (2,3), a, a+10);
a	IF(a IN (2,3), a, a+10)
2	2
3	3
1	11
4	14
SELECT a, IF(a NOT IN (2,3), a, a+10) FROM t1 
ORDER BY IF(a NOT IN (2,3), a, a+10);
a	IF(a NOT IN (2,3), a, a+10)
1	1
4	4
2	12
3	13
SELECT a, IF(a IN (2,3), a, a+10) FROM t1 
ORDER BY IF(a NOT IN (2,3), a, a+10);
a	IF(a IN (2,3), a, a+10)
1	11
4	14
2	2
3	3
SELECT a, IF(a BETWEEN 2 AND 3, a, a+10) FROM t1
ORDER BY IF(a BETWEEN 2 AND 3, a, a+10);
a	IF(a BETWEEN 2 AND 3, a, a+10)
2	2
3	3
1	11
4	14
SELECT a, IF(a NOT BETWEEN 2 AND 3, a, a+10) FROM t1 
ORDER BY IF(a NOT BETWEEN 2 AND 3, a, a+10);
a	IF(a NOT BETWEEN 2 AND 3, a, a+10)
1	1
4	4
2	12
3	13
SELECT a, IF(a BETWEEN 2 AND 3, a, a+10) FROM t1 
ORDER BY IF(a NOT BETWEEN 2 AND 3, a, a+10);
a	IF(a BETWEEN 2 AND 3, a, a+10)
1	11
4	14
2	2
3	3
SELECT IF(a IN (1,2), a, '') as x1, IF(a NOT IN (1,2), a, '') as x2
FROM t1 GROUP BY x1, x2;
x1	x2
	3
	4
1	
2	
SELECT IF(a IN (1,2), a, '') as x1, IF(a NOT IN (1,2), a, '') as x2
FROM t1 GROUP BY x1, IF(a NOT IN (1,2), a, '');
x1	x2
	3
	4
1	
2	
SELECT a, a IN (1,2) FROM t1 ORDER BY a IN (1,2);
a	a IN (1,2)
3	0
4	0
2	1
1	1
SELECT a FROM t1 ORDER BY a IN (1,2);
a
3
4
2
1
SELECT a+10 FROM t1 ORDER BY a IN (1,2);
a+10
13
14
12
11
SELECT a, IF(a IN (1,2), a, a+10) FROM t1
ORDER BY IF(a IN (3,4), a, a+10);
a	IF(a IN (1,2), a, a+10)
3	13
4	14
1	1
2	2
DROP TABLE t1;
create table t1 (a int not null, b  int not null, c int not null);
insert t1 values (1,1,1),(1,1,2),(1,2,1);
select a, b from t1 group by a, b order by sum(c);
a	b
1	2
1	1
drop table t1;
CREATE TABLE t1 (a int, b int, PRIMARY KEY  (a));
INSERT INTO t1 VALUES (1,1), (2,2), (3,3);
SELECT t2.b as c FROM 
t1 LEFT JOIN t1 t2 ON (t1.a = t2.a AND t2.a = 2) 
ORDER BY c;
c
NULL
NULL
2
CREATE TABLE t2 LIKE t1;
INSERT INTO t2 SELECT * from t1;
CREATE TABLE t3 LIKE t1;
INSERT INTO t3 SELECT * from t1;
CREATE TABLE t4 LIKE t1;
INSERT INTO t4 SELECT * from t1;
INSERT INTO t1 values (0,0),(4,4);
SELECT t2.b FROM t1 LEFT JOIN (t2, t3 LEFT JOIN t4 ON t3.a=t4.a)
ON (t1.a=t2.a AND t1.b=t3.b) order by t2.b;
b
NULL
NULL
1
2
3
DROP TABLE t1,t2,t3,t4;
create table t1 (a int, b int, c int);
insert into t1 values (1,2,3), (9,8,3), (19,4,3), (1,4,9);
select a,(sum(b)/sum(c)) as ratio from t1 group by a order by sum(b)/sum(c) asc;
a	ratio
1	0.5000
19	1.3333
9	2.6667
drop table t1;
CREATE TABLE t1 (a INT UNSIGNED NOT NULL, b TIME);
INSERT INTO t1 (a) VALUES (100000), (0), (100), (1000000),(10000), (1000), (10);
UPDATE t1 SET b = SEC_TO_TIME(a);
SELECT a, b FROM t1 ORDER BY b DESC;
a	b
1000000	277:46:40
100000	27:46:40
10000	02:46:40
1000	00:16:40
100	00:01:40
10	00:00:10
0	00:00:00
SELECT a, b FROM t1 ORDER BY SEC_TO_TIME(a) DESC;
a	b
1000000	277:46:40
100000	27:46:40
10000	02:46:40
1000	00:16:40
100	00:01:40
10	00:00:10
0	00:00:00
DROP TABLE t1;
CREATE TABLE t1 (a INT, b INT, PRIMARY KEY (a), UNIQUE KEY b (b));
INSERT INTO t1 VALUES (1,1),(2,2);
CREATE TABLE t2 (a INT, b INT, KEY a (a,b));
INSERT INTO t2 VALUES (1,1),(1,2),(2,1),(2,2);
DROP TABLE t1,t2;
CREATE TABLE t1 (
a INT,
b INT,
PRIMARY KEY (a),
KEY ab(a, b)
);
INSERT INTO t1 VALUES (1,1),(2,2),(3,3),(4,4);
INSERT INTO t1 SELECT a + 4, b + 4 FROM t1;
INSERT INTO t1 SELECT a + 8, b + 8 FROM t1;
INSERT INTO t1 SELECT a +16, b +16 FROM t1;
INSERT INTO t1 SELECT a +32, b +32 FROM t1;
INSERT INTO t1 SELECT a +64, b +64 FROM t1;
flush status;
SELECT a FROM t1 IGNORE INDEX FOR GROUP BY (PRIMARY, ab) GROUP BY a;
a
1
2
3
4
5
6
7
8
9
10
11
12
13
14
15
16
17
18
19
20
21
22
23
24
25
26
27
28
29
30
31
32
33
34
35
36
37
38
39
40
41
42
43
44
45
46
47
48
49
50
51
52
53
54
55
56
57
58
59
60
61
62
63
64
65
66
67
68
69
70
71
72
73
74
75
76
77
78
79
80
81
82
83
84
85
86
87
88
89
90
91
92
93
94
95
96
97
98
99
100
101
102
103
104
105
106
107
108
109
110
111
112
113
114
115
116
117
118
119
120
121
122
123
124
125
126
127
128
flush status;
SELECT a FROM t1 IGNORE INDEX FOR ORDER BY (PRIMARY, ab) ORDER BY a;
a
1
2
3
4
5
6
7
8
9
10
11
12
13
14
15
16
17
18
19
20
21
22
23
24
25
26
27
28
29
30
31
32
33
34
35
36
37
38
39
40
41
42
43
44
45
46
47
48
49
50
51
52
53
54
55
56
57
58
59
60
61
62
63
64
65
66
67
68
69
70
71
72
73
74
75
76
77
78
79
80
81
82
83
84
85
86
87
88
89
90
91
92
93
94
95
96
97
98
99
100
101
102
103
104
105
106
107
108
109
110
111
112
113
114
115
116
117
118
119
120
121
122
123
124
125
126
127
128
show status like 'Created_tmp_tables';
Variable_name	Value
Created_tmp_tables	0
flush status;
SELECT a FROM t1 IGNORE INDEX (PRIMARY, ab) GROUP BY a;
a
1
2
3
4
5
6
7
8
9
10
11
12
13
14
15
16
17
18
19
20
21
22
23
24
25
26
27
28
29
30
31
32
33
34
35
36
37
38
39
40
41
42
43
44
45
46
47
48
49
50
51
52
53
54
55
56
57
58
59
60
61
62
63
64
65
66
67
68
69
70
71
72
73
74
75
76
77
78
79
80
81
82
83
84
85
86
87
88
89
90
91
92
93
94
95
96
97
98
99
100
101
102
103
104
105
106
107
108
109
110
111
112
113
114
115
116
117
118
119
120
121
122
123
124
125
126
127
128
SELECT a FROM t1 IGNORE INDEX (PRIMARY, ab) ORDER BY a;
a
1
2
3
4
5
6
7
8
9
10
11
12
13
14
15
16
17
18
19
20
21
22
23
24
25
26
27
28
29
30
31
32
33
34
35
36
37
38
39
40
41
42
43
44
45
46
47
48
49
50
51
52
53
54
55
56
57
58
59
60
61
62
63
64
65
66
67
68
69
70
71
72
73
74
75
76
77
78
79
80
81
82
83
84
85
86
87
88
89
90
91
92
93
94
95
96
97
98
99
100
101
102
103
104
105
106
107
108
109
110
111
112
113
114
115
116
117
118
119
120
121
122
123
124
125
126
127
128
show status like 'Created_tmp_tables';
Variable_name	Value
Created_tmp_tables	0
DROP TABLE t1;
#
# Bug#31590: Wrong error message on sort buffer being too small.
#
create table t1(a int, b tinytext);
insert into t1 values (1,2),(3,2);
set session sort_buffer_size= 30000;
Warnings:
Warning	1292	Truncated incorrect sort_buffer_size value: '30000'
set session max_sort_length= 2180;
CALL mtr.add_suppression("Out of sort memory");
select * from t1 order by b;
ERROR HY001: Out of sort memory, consider increasing server sort buffer size
drop table t1;
call mtr.add_suppression("Out of sort memory; increase server sort buffer size");
#
# Bug #39844: Query Crash Mysql Server 5.0.67
#
CREATE TABLE t1 (a INT PRIMARY KEY);
CREATE TABLE t2 (a INT PRIMARY KEY, b INT);
CREATE TABLE t3 (c INT);
INSERT INTO t1 (a) VALUES (1), (2);
INSERT INTO t2 (a,b) VALUES (1,2), (2,3);
INSERT INTO t3 (c) VALUES (1), (2);
SELECT
(SELECT t1.a FROM t1, t2 WHERE t1.a = t2.b AND t2.a = t3.c ORDER BY t1.a)
FROM t3;
(SELECT t1.a FROM t1, t2 WHERE t1.a = t2.b AND t2.a = t3.c ORDER BY t1.a)
2
NULL
DROP TABLE t1, t2, t3;
#
# Bug #42760: Select doesn't return desired results when we have null
# values
#
CREATE TABLE t1 (
a INT,
c INT,
UNIQUE KEY a_c (a,c),
KEY (a));
INSERT INTO t1 VALUES (1, 10), (2, NULL);
# Must use ref-or-null on the a_c index
# Must return 1 row
SELECT 1 AS col FROM t1 WHERE a=2 AND (c=10 OR c IS NULL) ORDER BY c;
col
1
# Must use ref-or-null on the a_c index
# Must return 1 row
SELECT 1 AS col FROM t1 WHERE a=2 AND (c=10 OR c IS NULL) ORDER BY c DESC;
col
1
DROP TABLE t1;
End of 5.0 tests
CREATE TABLE t2 (a varchar(32), b int(11), c float, d double, 
UNIQUE KEY a (a,b,c), KEY b (b), KEY c (c));
CREATE TABLE t1 (a varchar(32), b char(3), UNIQUE KEY a (a,b), KEY b (b));
CREATE TABLE t3 (a varchar(32), b char(3), UNIQUE KEY a (a,b));
INSERT INTO t3 SELECT * FROM t1;
SELECT d FROM t1, t2
WHERE t2.b=14 AND t2.a=t1.a AND 5.1<t2.c AND t1.b='DE'
ORDER BY t2.c LIMIT 1;
d
52.5
SELECT d FROM t3 AS t1, t2 AS t2 
WHERE t2.b=14 AND t2.a=t1.a AND 5.1<t2.c AND t1.b='DE'
ORDER BY t2.c LIMIT 1;
d
52.5
DROP TABLE t1,t2,t3;
#
# WL#1393 - Optimizing filesort with small limit
#
# End of Bug #58761
CREATE TABLE t1 (
id1 INT NOT NULL,
id2 INT  NOT NULL,
junk INT NOT NULL,
PRIMARY KEY (id1, id2, junk),
INDEX id2_j_id1 (id2, junk, id1)
);
INSERT INTO t1 VALUES (1, 1, 1), (2, 1, 2), (3, 1, 3), (4, 1, 4);
INSERT INTO t1 VALUES (5, 2, 1), (6, 2, 2), (7, 2, 3), (8, 2, 4);
INSERT INTO t1 VALUES (9, 3, 1), (10, 3, 2), (11, 3, 3), (12, 3, 4);
INSERT INTO t1 VALUES (13, 4, 1), (14, 4, 2), (15, 4, 3), (16, 4, 4);
INSERT INTO t1 VALUES (17, 5, 1), (18, 5, 2), (19, 5, 3), (20, 5, 4);
INSERT INTO t1 VALUES (21, 6, 1), (22, 6, 2), (23, 6, 3), (24, 6, 4);
INSERT INTO t1 VALUES (25, 7, 1), (26, 7, 2), (27, 7, 3), (28, 7, 4);
INSERT INTO t1 VALUES (29, 8, 1), (30, 8, 2), (31, 8, 3), (32, 8, 4);
INSERT INTO t1 VALUES (33, 9, 1), (34, 9, 2), (35, 9, 3), (36, 9, 4);
SELECT id1 FROM t1 WHERE id2 = 4 ORDER BY id1;
id1
13
14
15
16
DROP TABLE t1;
CREATE TABLE t1 (
a INT,
b INT NOT NULL,
c char(100),
KEY (b, c),
KEY (b, a, c)
)
DEFAULT CHARSET = utf8;
INSERT INTO t1 VALUES 
(1,  1, 1),
(2,  2, 2),
(3,  3, 3),
(4,  4, 4),
(5,  5, 5),
(6,  6, 6),
(7,  7, 7),
(8,  8, 8),
(9,  9, 9);
INSERT INTO t1 SELECT a + 10,  b, c FROM t1;
INSERT INTO t1 SELECT a + 20,  b, c FROM t1;
INSERT INTO t1 SELECT a + 40,  b, c FROM t1;
INSERT INTO t1 SELECT a + 80,  b, c FROM t1;
INSERT INTO t1 SELECT a + 160, b, c FROM t1;
INSERT INTO t1 SELECT a + 320, b, c FROM t1;
INSERT INTO t1 SELECT a + 640, b, c FROM t1;
INSERT INTO t1 SELECT a + 1280, b, c FROM t1 ORDER BY a LIMIT 80;
SELECT a FROM t1 WHERE b = 1 ORDER BY a DESC LIMIT 9;
a
1361
1351
1341
1331
1321
1311
1301
1291
1281
SELECT DISTINCT a FROM t1 WHERE b = 1 ORDER BY a DESC LIMIT 0, 9;
a
1361
1351
1341
1331
1321
1311
1301
1291
1281
DROP TABLE t1;
#
# Bug #43029: FORCE INDEX FOR ORDER BY is ignored when join buffering 
#   is used
#
CREATE TABLE t1 (a INT, b INT, KEY (a));
INSERT INTO t1 VALUES (0, NULL), (1, NULL), (2, NULL), (3, NULL);
INSERT INTO t1 SELECT a+4, b FROM t1;
INSERT INTO t1 SELECT a+8, b FROM t1;
CREATE TABLE t2 (a INT, b INT);
INSERT INTO t2 VALUES (0,NULL), (1,NULL), (2,NULL), (3,NULL), (4,NULL);
INSERT INTO t2 SELECT a+4, b FROM t2;
# shouldn't have "using filesort"
# should have "using filesort"
# should have "using filesort"
DROP TABLE t1, t2;
#
# Bug #50394: Regression in EXPLAIN with index scan, LIMIT, GROUP BY and
# ORDER BY computed col
#
CREATE TABLE t1 ( a INT NOT NULL, b INT NOT NULL, KEY( a, b ) );
INSERT INTO t1 VALUES (1, 1), (2, 2), (3, 3), (4, 4), (5, 5);
INSERT INTO t1 SELECT a + 5, b + 5 FROM t1;
CREATE TABLE t2( a INT PRIMARY KEY, b INT );
INSERT INTO t2 VALUES (1, 1), (2, 2), (3, 3), (4, 4), (5, 5);
INSERT INTO t2 SELECT a + 5, b + 5 FROM t2;
DROP TABLE t1, t2;
#
# Bug #59110: Memory leak of QUICK_SELECT_I allocated memory 
#  and
# Bug #59308: Incorrect result for 
SELECT DISTINCT <col>... ORDER BY <col> DESC 

# Use Valgrind to detect #59110!
#
CREATE TABLE t1 (a INT,KEY (a));
INSERT INTO t1 VALUES (1),(2),(3),(4),(5),(6),(7),(8),(9),(10);
SELECT DISTINCT a,1 FROM t1 WHERE a <> 1 ORDER BY a DESC;
a	1
10	1
9	1
8	1
7	1
6	1
5	1
4	1
3	1
2	1
DROP TABLE t1;
#
# Bug#11765255 58201:
# VALGRIND/CRASH WHEN ORDERING BY MULTIPLE AGGREGATE FUNCTIONS
#
select count(*) order by max(1) + min(1);
count(*)
1
End of 5.1 tests
#
# Bug #38745: MySQL 5.1 optimizer uses filesort for ORDER BY
#             when it should use index
#
CREATE TABLE t1 (i1 integer NOT NULL PRIMARY KEY);
CREATE TABLE t2 (i2 integer NOT NULL PRIMARY KEY);
CREATE TABLE t3 (i3 integer);
INSERT INTO t1 VALUES (1), (2), (3), (4), (5), (6), (7), (8), (9), (10), (11), (12);
INSERT INTO t2 SELECT * FROM t1;
SELECT t1.*, t2.* FROM t1 JOIN t2 ON t1.i1 = t2.i2 
LEFT JOIN t3 ON t2.i2 = t3.i3
ORDER BY t1.i1 LIMIT 5;
i1	i2
1	1
2	2
3	3
4	4
5	5
DROP TABLE t1, t2, t3;
#
# Bug #11885377 VOID JOIN_READ_KEY_UNLOCK_ROW(ST_JOIN_TABLE*): ASSERTION
# `TAB->REF.USE_COUNT'
#
CREATE TABLE t1(a INT PRIMARY KEY);
CREATE TABLE t2(b INT,c INT);
INSERT INTO t1 VALUES (1), (2);
INSERT INTO t2 VALUES (1,2), (2,3);
SELECT (SELECT 1 FROM t1 WHERE a=b AND c=1 ORDER BY a DESC) FROM t2;
(SELECT 1 FROM t1 WHERE a=b AND c=1 ORDER BY a DESC)
NULL
NULL
DROP TABLE t1, t2;
#
# Bug #13531865
# TEST_IF_SKIP_SORT_ORDER() INCORRECTLY SKIP FILESORT IF
# 'TYPE' IS REF_OR_NULL 
# 
#
CREATE TABLE t1 (
a INT,
c INT,
UNIQUE KEY a_c (a,c),
KEY (a)) engine=sequoiadb;
INSERT INTO t1 VALUES (1,10), (2,NULL), (2,10);
# Using 'KEY a_c' for order-by opt, would have required 
# REF_OR_NULL access which never can be order_by skipped.
# -> Keep initial REF on 'KEY a' selected by cond. optimizer
SELECT c FROM t1 WHERE a=2 AND (c=10 OR c IS NULL) ORDER BY c;
c
NULL
10
SELECT c FROM t1 WHERE a=2 AND (c=10 OR c IS NULL) ORDER BY c DESC;
c
10
NULL
DROP TABLE t1;
#
# Bug #13528826 
# TEST_IF_CHEAPER_ORDERING(): CALCULATES INCORRECT 'SELECT_LIMIT'
# 
#
CREATE TABLE t1(a int PRIMARY KEY, b int) ENGINE=sequoiadb;
INSERT INTO t1 VALUES
(5, 10), (2, 70), (7, 80), (6, 20), (1, 50), (9, 40), (8, 30), (3, 60);
CREATE TABLE t2 (p int, a int, INDEX i_a(a)) ENGINE=sequoiadb;
INSERT INTO t2 VALUES
(103, 7), (109, 3), (102, 3), (108, 1), (106, 3),
(107, 7), (105, 1), (101, 3), (100, 7), (110, 1);
# number of rows in t1 was incorrectly used as an 
# implicit limit-clause if not explicit specified
# Query above used to be explained identical to this:
# A really high limit was required to give the correct explain
DROP TABLE t1, t2;
#
# Bug #13949068 ASSERT TAB->REF.KEY == REF_KEY IN
# PLAN_CHANGE_WATCHDOG::~PLAN_CHANGE_WATCHDOG
#
CREATE TABLE t1 (a INT, b INT, KEY(b), KEY(b,a)) ENGINE=SEQUOIADB;
INSERT INTO t1 VALUES (0,0);
SELECT DISTINCT a FROM t1 WHERE b=1 ORDER BY 1;
a
DROP TABLE t1;
#
# Bug#18636076 DEBUG CRASH ON 
#              PLAN_CHANGE_WATCHDOG::~PLAN_CHANGE_WATCHDOG
#
CREATE TABLE t1 (
pk INTEGER NOT NULL,
PRIMARY KEY (pk)
) ENGINE=SequoiaDB;
INSERT INTO t1 VALUES (1), (2), (3);
CREATE VIEW view_t1 AS SELECT * FROM t1;
CREATE TABLE t2 (
i1 INTEGER NOT NULL
) ENGINE=SequoiaDB;
SELECT DISTINCT t2.i1, view_t1.pk
FROM view_t1 LEFT JOIN t2
ON  view_t1.pk = t2.i1
WHERE (view_t1.pk <= 204 AND t2.i1 != 3)
OR view_t1.pk BETWEEN 1 AND 7
ORDER BY t2.i1,view_t1.pk;
i1	pk
NULL	1
NULL	2
NULL	3
DROP VIEW view_t1;
DROP TABLE t1, t2;
SET sql_mode = default;
#
# Bug#20455386 INVALID WRITE IN COPY_FIELD::SET CAUSE CRASH WITH TMP TABLES
#
CREATE TABLE t1(a INT) ENGINE=SEQUOIADB;
CREATE TABLE t2(c INT) ENGINE=SEQUOIADB;
CREATE TABLE t3(b BLOB NOT NULL) ENGINE=SEQUOIADB;
SELECT
(SELECT 1 FROM t1
WHERE (SELECT c FROM t2 ORDER BY COUNT(t3.b ))
)
FROM t3;
(SELECT 1 FROM t1
WHERE (SELECT c FROM t2 ORDER BY COUNT(t3.b ))
)
NULL
DROP TABLE t1,t2,t3;
set optimizer_switch=default;
