drop table if exists t1;
SET SQL_SAFE_UPDATES=1,SQL_SELECT_LIMIT=4, MAX_JOIN_SIZE=42;
create table t1 (a int primary key, b char(20));
insert into t1 values(1,"test");
SELECT SQL_BUFFER_RESULT * from t1;
a	b
1	test
update t1 set b="a" where a=1;
delete from t1 where a=1;
insert into t1 values(1,"test"),(2,"test2");
SELECT SQL_BUFFER_RESULT * from t1;
a	b
1	test
2	test2
update t1 set b="a" where a=1;
select 1 from t1,t1 as t2,t1 as t3;
1
1
1
1
1
update t1 set b="a";
ERROR HY000: You are using safe update mode and you tried to update a table without a WHERE that uses a KEY column
update t1 set b="a" where b="test";
ERROR HY000: You are using safe update mode and you tried to update a table without a WHERE that uses a KEY column
delete from t1;
ERROR HY000: You are using safe update mode and you tried to update a table without a WHERE that uses a KEY column
delete from t1 where b="test";
ERROR HY000: You are using safe update mode and you tried to update a table without a WHERE that uses a KEY column
delete from t1 where a+0=1;
ERROR HY000: You are using safe update mode and you tried to update a table without a WHERE that uses a KEY column
select 1 from t1,t1 as t2,t1 as t3,t1 as t4,t1 as t5;
ERROR 42000: The SELECT would examine more than MAX_JOIN_SIZE rows; check your WHERE and use SET SQL_BIG_SELECTS=1 or SET MAX_JOIN_SIZE=# if the SELECT is okay
update t1 set b="a" limit 1;
update t1 set b="a" where b="b" limit 2;
delete from t1 where b="test" limit 1;
delete from t1 where a+0=1 limit 2;
drop table t1;
create table t1 (a int);
insert into t1 values (1),(2),(3),(4),(5);
insert into t1 select * from t1;
insert into t1 select * from t1;
insert into t1 select * from t1;
set local  max_join_size=8;
select * from (select * from t1) x;
ERROR 42000: The SELECT would examine more than MAX_JOIN_SIZE rows; check your WHERE and use SET SQL_BIG_SELECTS=1 or SET MAX_JOIN_SIZE=# if the SELECT is okay
set local  max_join_size=1;
select * from (select a.a as aa, b.a as ba from t1 a, t1 b) x;
ERROR 42000: The SELECT would examine more than MAX_JOIN_SIZE rows; check your WHERE and use SET SQL_BIG_SELECTS=1 or SET MAX_JOIN_SIZE=# if the SELECT is okay
set local  max_join_size=1;
select * from (select 1 union select 2 union select 3) x;
ERROR 42000: The SELECT would examine more than MAX_JOIN_SIZE rows; check your WHERE and use SET SQL_BIG_SELECTS=1 or SET MAX_JOIN_SIZE=# if the SELECT is okay
drop table t1;
SET SQL_SAFE_UPDATES=0,SQL_SELECT_LIMIT=DEFAULT, MAX_JOIN_SIZE=DEFAULT;
