set optimizer_switch='batched_key_access=on,mrr_cost_based=off';
set optimizer_switch='index_condition_pushdown=on,mrr=on,mrr_cost_based=off';
drop table if exists t1,t2,t3,t4,t11;
drop table if exists t1_1,t1_2,t9_1,t9_2,t1aa,t2aa;
drop view if exists v1;
CREATE TABLE t1 (
Period smallint(4) unsigned zerofill DEFAULT '0000' NOT NULL,
Varor_period smallint(4) unsigned DEFAULT '0' NOT NULL
);
INSERT INTO t1 VALUES (9410,9412);
select period from t1;
period
9410
select * from t1;
Period	Varor_period
9410	9412
select t1.* from t1;
Period	Varor_period
9410	9412
create table t3 (
period    int not null,
name      char(32) not null,
companynr int not null,
price     double(11,0),
price2     double(11,0),
key (period),
key (name)
);
select period from t1;
period
9410
select period from t1 where period=1900;
period
select period from t1 where (((period > 0) or period < 10000 or (period = 1900)) and (period=1900 and period <= 1901) or (period=1903 and (period=1903)) and period>=1902) or ((period=1904 or period=1905) or (period=1906 or period>1907)) or (period=1908 and period = 1909);
period
9410
select period from t1 where ((period > 0 and period < 1) or (((period > 0 and period < 100) and (period > 10)) or (period > 10)) or (period > 0 and (period > 5 or period > 6)));
period
9410
select count(*) from t1;
count(*)
1
select sum(Period)/count(*) from t1;
sum(Period)/count(*)
9410.0000
select t1.period from t3 = t1 limit 1;
period
1001
select t1.period from t1 as t1 limit 1;
period
9410
select t1.period as "Nuvarande period" from t1 as t1 limit 1;
Nuvarande period
9410
select period as ok_period from t1 limit 1;
ok_period
9410
select period as ok_period from t1 group by ok_period limit 1;
ok_period
9410
select 1+1 as summa from t1 group by summa limit 1;
summa
2
select period as "Nuvarande period" from t1 group by "Nuvarande period" limit 1;
Nuvarande period
9410
show tables;
Tables_in_test
t1
t3
show tables from test like "s%";
Tables_in_test (s%)
show tables from test like "t?";
Tables_in_test (t?)
drop table if exists t3, t1;
DO 1;
DO benchmark(100,1+1),1,1;
do default;
ERROR 42000: You have an error in your SQL syntax; check the manual that corresponds to your MySQL server version for the right syntax to use near '' at line 1
do foobar;
ERROR 42S22: Unknown column 'foobar' in 'field list'
create table  t1 (  A_Id bigint(20) NOT NULL default '0',  A_UpdateBy char(10) NOT NULL default '',  A_UpdateDate bigint(20) NOT NULL default '0',  A_UpdateSerial int(11) NOT NULL default '0',  other_types bigint(20) NOT NULL default '0',  wss_type bigint(20) NOT NULL default '0');
INSERT INTO t1 VALUES (102935998719055004,'brade',1029359987,2,102935229116544068,102935229216544093);
select wss_type from t1 where wss_type ='102935229216544106';
wss_type
select wss_type from t1 where wss_type ='102935229216544105';
wss_type
select wss_type from t1 where wss_type ='102935229216544104';
wss_type
select wss_type from t1 where wss_type ='102935229216544093';
wss_type
102935229216544093
select wss_type from t1 where wss_type =102935229216544093;
wss_type
102935229216544093
drop table t1;
select 1+2,"aaaa",3.13*2.0 into @a,@b,@c;
select @a;
@a
3
select @b;
@b
aaaa
select @c;
@c
6.260
create table t1 (id1 int NOT NULL);
create table t2 (id2 int NOT NULL);
create table t3 (id3 int NOT NULL);
create table t4 (id4 int NOT NULL, id44 int NOT NULL, KEY (id4));
insert into t1 values (1);
insert into t1 values (2);
insert into t2 values (1);
insert into t4 values (1,1);
select * from t1 left join t2 on id1 = id2 left join t3 on id1 = id3
left join t4 on id3 = id4 where id2 = 1 or id4 = 1;
id1	id2	id3	id4	id44
1	1	NULL	NULL	NULL
drop table t1,t2,t3,t4;
create table t1(s varchar(10) not null);
create table t2(s varchar(10) not null primary key);
create table t3(s varchar(10) not null primary key);
insert into t1 values ('one\t'), ('two\t');
insert into t2 values ('one\r'), ('two\t');
insert into t3 values ('one '), ('two\t');
select * from t1 where s = 'one';
s
select * from t2 where s = 'one';
s
select * from t3 where s = 'one';
s
one 
drop table t1, t2, t3;
create table t1 (a integer,  b integer, index(a), index(b));
create table t2 (c integer,  d integer, index(c), index(d));
insert into t1 values (1,2), (2,2), (3,2), (4,2);
insert into t2 values (1,3), (2,3), (3,4), (4,4);
select * from t1 left join t2 on a=c where d in (4);
a	b	c	d
3	2	3	4
4	2	4	4
select * from t1 left join t2 on a=c where d = 4;
a	b	c	d
3	2	3	4
4	2	4	4
drop table t1, t2;
CREATE TABLE t1 (
i int(11) NOT NULL default '0',
c char(10) NOT NULL default '',
PRIMARY KEY  (i),
UNIQUE KEY c (c)
) ENGINE=SequoiaDB;
INSERT INTO t1 VALUES (1,'a');
INSERT INTO t1 VALUES (2,'b');
INSERT INTO t1 VALUES (3,'c');
DROP TABLE t1;
CREATE TABLE t1 ( city char(30) );
INSERT INTO t1 VALUES ('London');
INSERT INTO t1 VALUES ('Paris');
SELECT * FROM t1 WHERE city='London';
city
London
SELECT * FROM t1 WHERE city='london';
city
SELECT * FROM t1 WHERE city='London' AND city='london';
city
London
SELECT * FROM t1 WHERE city LIKE '%london%' AND city='London';
city
London
DROP TABLE t1;
create table t1 (a int(11) unsigned, b int(11) unsigned);
insert into t1 values (1,0), (1,1);
select a-b  from t1 order by 1;
a-b
0
1
select a-b , (a-b < 0)  from t1 order by 1;
a-b	(a-b < 0)
0	0
1	0
select a-b as d, (a-b >= 0), b from t1 group by b having d >= 0;
d	(a-b >= 0)	b
1	1	0
0	1	1
select cast((a - b) as unsigned) from t1 order by 1;
cast((a - b) as unsigned)
0
1
drop table t1;
create table t1 (a int(11));
select all all * from t1;
a
select distinct distinct * from t1;
a
select all distinct * from t1;
ERROR HY000: Incorrect usage of ALL and DISTINCT
select distinct all * from t1;
ERROR HY000: Incorrect usage of ALL and DISTINCT
drop table t1;
CREATE TABLE t1 (
kunde_intern_id int(10) unsigned NOT NULL default '0',
kunde_id int(10) unsigned NOT NULL default '0',
FK_firma_id int(10) unsigned NOT NULL default '0',
aktuell enum('Ja','Nein') NOT NULL default 'Ja',
vorname varchar(128) NOT NULL default '',
nachname varchar(128) NOT NULL default '',
geloescht enum('Ja','Nein') NOT NULL default 'Nein',
firma varchar(128) NOT NULL default ''
);
INSERT INTO t1 VALUES 
(3964,3051,1,'Ja','Vorname1','1Nachname','Nein','Print Schau XXXX'),
(3965,3051111,1,'Ja','Vorname1111','1111Nachname','Nein','Print Schau XXXX');
SELECT kunde_id ,FK_firma_id ,aktuell, vorname, nachname, geloescht FROM t1
WHERE
(
(
( '' != '' AND firma LIKE CONCAT('%', '', '%'))
OR
(vorname LIKE CONCAT('%', 'Vorname1', '%') AND 
nachname LIKE CONCAT('%', '1Nachname', '%') AND 
'Vorname1' != '' AND 'xxxx' != '')
)
AND
(
aktuell = 'Ja' AND geloescht = 'Nein' AND FK_firma_id = 2
)
)
;
kunde_id	FK_firma_id	aktuell	vorname	nachname	geloescht
SELECT kunde_id ,FK_firma_id ,aktuell, vorname, nachname,
geloescht FROM t1
WHERE
(
(
aktuell = 'Ja' AND geloescht = 'Nein' AND FK_firma_id = 2
)
AND
(
( '' != '' AND firma LIKE CONCAT('%', '', '%')  )
OR
(  vorname LIKE CONCAT('%', 'Vorname1', '%') AND
nachname LIKE CONCAT('%', '1Nachname', '%') AND 'Vorname1' != '' AND
'xxxx' != '')
)
)
;
kunde_id	FK_firma_id	aktuell	vorname	nachname	geloescht
SELECT COUNT(*) FROM t1 WHERE 
( 0 OR (vorname LIKE '%Vorname1%' AND nachname LIKE '%1Nachname%' AND 1)) 
AND FK_firma_id = 2;
COUNT(*)
0
drop table t1;
CREATE TABLE t1 (b BIGINT(20) UNSIGNED NOT NULL, PRIMARY KEY (b));
INSERT INTO t1 VALUES (0x8000000000000000);
SELECT b FROM t1 WHERE b=0x8000000000000000;
b
9223372036854775808
DROP TABLE t1;
CREATE TABLE `t1` ( `gid` int(11) default NULL, `uid` int(11) default NULL);
CREATE TABLE `t2` ( `ident` int(11) default NULL, `level` char(16) default NULL);
INSERT INTO `t2` VALUES (0,'READ');
CREATE TABLE `t3` ( `id` int(11) default NULL, `name` char(16) default NULL);
INSERT INTO `t3` VALUES (1,'fs');
select * from t3 left join t1 on t3.id = t1.uid, t2 where t2.ident in (0, t1.gid, t3.id, 0);
id	name	gid	uid	ident	level
1	fs	NULL	NULL	0	READ
drop table t1,t2,t3;
CREATE TABLE t1 (
acct_id int(11) NOT NULL default '0',
profile_id smallint(6) default NULL,
UNIQUE KEY t1$acct_id (acct_id),
KEY t1$profile_id (profile_id)
);
INSERT INTO t1 VALUES (132,17),(133,18);
CREATE TABLE t2 (
profile_id smallint(6) default NULL,
queue_id int(11) default NULL,
seq int(11) default NULL,
KEY t2$queue_id (queue_id)
);
INSERT INTO t2 VALUES (17,31,4),(17,30,3),(17,36,2),(17,37,1);
CREATE TABLE t3 (
id int(11) NOT NULL default '0',
qtype int(11) default NULL,
seq int(11) default NULL,
warn_lvl int(11) default NULL,
crit_lvl int(11) default NULL,
rr1 tinyint(4) NOT NULL default '0',
rr2 int(11) default NULL,
default_queue tinyint(4) NOT NULL default '0',
KEY t3$qtype (qtype),
KEY t3$id (id)
);
INSERT INTO t3 VALUES (30,1,29,NULL,NULL,0,NULL,0),(31,1,28,NULL,NULL,0,NULL,0),
(36,1,34,NULL,NULL,0,NULL,0),(37,1,35,NULL,NULL,0,121,0);
SELECT COUNT(*) FROM t1 a STRAIGHT_JOIN t2 pq STRAIGHT_JOIN t3 q 
WHERE 
(pq.profile_id = a.profile_id) AND (a.acct_id = 132) AND 
(pq.queue_id = q.id) AND (q.rr1 <> 1);
COUNT(*)
4
drop table t1,t2,t3;
create table t1 (f1 int);
insert into t1 values (1),(NULL);
create table t2 (f2 int, f3 int, f4 int);
create index idx1 on t2 (f4);
insert into t2 values (1,2,3),(2,4,6);
select A.f2 from t1 left join t2 A on A.f2 = f1 where A.f3=(select min(f3)
from  t2 C where A.f4 = C.f4) or A.f3 IS NULL;
f2
1
NULL
drop table t1,t2;
create table t2 (a tinyint unsigned);
create index t2i on t2(a);
insert into t2 values (0), (254), (255);
select * from t2 where a > -1;
a
0
254
255
drop table t2;
CREATE TABLE t1 (a int, b int, c int);
INSERT INTO t1
SELECT 50, 3, 3 FROM DUAL
WHERE NOT EXISTS
(SELECT * FROM t1 WHERE a = 50 AND b = 3);
SELECT * FROM t1;
a	b	c
50	3	3
INSERT INTO t1
SELECT 50, 3, 3 FROM DUAL
WHERE NOT EXISTS
(SELECT * FROM t1 WHERE a = 50 AND b = 3);
select found_rows();
found_rows()
0
SELECT * FROM t1;
a	b	c
50	3	3
select count(*) from t1;
count(*)
1
select found_rows();
found_rows()
1
select count(*) from t1 limit 2,3;
count(*)
select found_rows();
found_rows()
1
select SQL_CALC_FOUND_ROWS count(*) from t1 limit 2,3;
count(*)
select found_rows();
found_rows()
1
DROP TABLE t1;
CREATE TABLE t1 (a INT, b INT);
(SELECT a, b AS c FROM t1) ORDER BY c+1;
a	c
(SELECT a, b AS c FROM t1) ORDER BY b+1;
a	c
SELECT a, b AS c FROM t1 ORDER BY c+1;
a	c
SELECT a, b AS c FROM t1 ORDER BY b+1;
a	c
drop table t1;
create table t1(f1 int, f2 int);
create table t2(f3 int);
select f1 from t1,t2 where f1=f2 and (f1,f2) = ((1,1));
f1
select f1 from t1,t2 where f1=f2 and (f1,NULL) = ((1,1));
f1
select f1 from t1,t2 where f1=f2 and (f1,f2) = ((1,NULL));
f1
insert into t1 values(1,1),(2,null);
insert into t2 values(2);
select * from t1,t2 where f1=f3 and (f1,f2) = (2,null);
f1	f2	f3
select * from t1,t2 where f1=f3 and (f1,f2) <=> (2,null);
f1	f2	f3
2	NULL	2
drop table t1,t2;
CREATE TABLE t1 ( a INT NOT NULL, b INT NOT NULL, UNIQUE idx (a,b) );
INSERT INTO t1 VALUES (1,1),(1,2),(1,3),(1,4);
CREATE TABLE t2 ( a INT NOT NULL, b INT NOT NULL, e INT );
INSERT INTO t2 VALUES ( 1,10,1), (1,10,2), (1,11,1), (1,11,2), (1,2,1), (1,2,2),(1,2,3);
SELECT t2.a, t2.b, IF(t1.b IS NULL,'',e) AS c, COUNT(*) AS d FROM t2 LEFT JOIN
t1 ON t2.a = t1.a AND t2.b = t1.b GROUP BY a, b, c;
a	b	c	d
1	2	1	1
1	2	2	1
1	2	3	1
1	10		2
1	11		2
SELECT t2.a, t2.b, IF(t1.b IS NULL,'',e) AS c, COUNT(*) AS d FROM t2 LEFT JOIN
t1 ON t2.a = t1.a AND t2.b = t1.b GROUP BY t1.a, t1.b, c;
a	b	c	d
1	10		4
1	2	1	1
1	2	2	1
1	2	3	1
SELECT t2.a, t2.b, IF(t1.b IS NULL,'',e) AS c, COUNT(*) AS d FROM t2 LEFT JOIN
t1 ON t2.a = t1.a AND t2.b = t1.b GROUP BY t2.a, t2.b, c;
a	b	c	d
1	2	1	1
1	2	2	1
1	2	3	1
1	10		2
1	11		2
SELECT t2.a, t2.b, IF(t1.b IS NULL,'',e) AS c, COUNT(*) AS d FROM t2,t1
WHERE t2.a = t1.a AND t2.b = t1.b GROUP BY a, b, c;
a	b	c	d
1	2	1	1
1	2	2	1
1	2	3	1
DROP TABLE IF EXISTS t1, t2;
create table t1 (f1 int primary key, f2 int);
create table t2 (f3 int, f4 int, primary key(f3,f4));
insert into t1 values (1,1);
insert into t2 values (1,1),(1,2);
select distinct count(f2) >0 from t1 left join t2 on f1=f3 group by f1;
count(f2) >0
1
drop table t1,t2;
create table t1 (f1 int,f2 int);
insert into t1 values(1,1);
create table t2 (f3 int, f4 int, primary key(f3,f4));
insert into t2 values(1,1);
select * from t1 where f1 in (select f3 from t2 where (f3,f4)= (select f3,f4 from t2));
f1	f2
1	1
drop table t1,t2;
CREATE TABLE t1(a int, b int, c int, KEY b(b), KEY c(c));
insert into t1 values (1,0,0),(2,0,0);
CREATE TABLE t2 (a int, b varchar(2), c varchar(2), PRIMARY KEY(a));
insert into t2 values (1,'',''), (2,'','');
CREATE TABLE t3 (a int, b int, PRIMARY KEY (a,b), KEY a (a), KEY b (b));
insert into t3 values (1,1),(1,2);
DROP TABLE t1,t2,t3;
CREATE TABLE t1 (a int, INDEX idx(a));
INSERT INTO t1 VALUES (2), (3), (1);
EXPLAIN SELECT * FROM t1 IGNORE INDEX (a);
ERROR 42000: Key 'a' doesn't exist in table 't1'
EXPLAIN SELECT * FROM t1 FORCE INDEX (a);
ERROR 42000: Key 'a' doesn't exist in table 't1'
DROP TABLE t1;
CREATE TABLE t1 (a int, b int);
INSERT INTO t1 VALUES (1,1), (2,1), (4,10);
CREATE TABLE t2 (a int PRIMARY KEY, b int, KEY b (b));
INSERT INTO t2 VALUES (1,NULL), (2,10);
ALTER TABLE t1 ENABLE KEYS;
Warnings:
Note	1031	Table storage engine for 't1' doesn't have this option
SELECT STRAIGHT_JOIN SQL_NO_CACHE * FROM t2, t1 WHERE t1.b = t2.b OR t2.b IS NULL;
a	b	a	b
1	NULL	1	1
1	NULL	2	1
1	NULL	4	10
2	10	4	10
SELECT STRAIGHT_JOIN SQL_NO_CACHE * FROM t2, t1 WHERE t1.b = t2.b OR t2.b IS NULL;
a	b	a	b
1	NULL	1	1
1	NULL	2	1
1	NULL	4	10
2	10	4	10
DROP TABLE IF EXISTS t1,t2;
CREATE TABLE t1 (key1 float default NULL, UNIQUE KEY key1 (key1));
CREATE TABLE t2 (key2 float default NULL, UNIQUE KEY key2 (key2));
INSERT INTO t1 VALUES (0.3762),(0.3845),(0.6158),(0.7941);
INSERT INTO t2 VALUES (1.3762),(1.3845),(1.6158),(1.7941);
select max(key1) from t1 where key1 <= 0.6158;
max(key1)
0.6158000230789185
select max(key2) from t2 where key2 <= 1.6158;
max(key2)
1.6158000230789185
select min(key1) from t1 where key1 >= 0.3762;
min(key1)
0.37619999051094055
select min(key2) from t2 where key2 >= 1.3762;
min(key2)
1.3761999607086182
select max(key1), min(key2) from t1, t2
where key1 <= 0.6158 and key2 >= 1.3762;
max(key1)	min(key2)
0.6158000230789185	1.3761999607086182
select max(key1) from t1 where key1 <= 0.6158 and rand() + 0.5 >= 0.5;
max(key1)
0.6158000230789185
select min(key1) from t1 where key1 >= 0.3762 and rand() + 0.5 >= 0.5;
min(key1)
0.37619999051094055
DROP TABLE t1,t2;
CREATE TABLE t1 (i BIGINT UNSIGNED NOT NULL);
INSERT INTO t1 VALUES (10);
SELECT i='1e+01',i=1e+01, i in (1e+01,1e+01), i in ('1e+01','1e+01') FROM t1;
i='1e+01'	i=1e+01	i in (1e+01,1e+01)	i in ('1e+01','1e+01')
1	1	1	1
DROP TABLE t1;
create table t1(a bigint unsigned, b bigint);
insert ignore into t1 values (0xfffffffffffffffff, 0xfffffffffffffffff), 
(0x10000000000000000, 0x10000000000000000), 
(0x8fffffffffffffff, 0x8fffffffffffffff);
Warnings:
Warning	1264	Out of range value for column 'a' at row 1
Warning	1264	Out of range value for column 'b' at row 1
Warning	1264	Out of range value for column 'a' at row 2
Warning	1264	Out of range value for column 'b' at row 2
Warning	1264	Out of range value for column 'b' at row 3
select hex(a), hex(b) from t1;
hex(a)	hex(b)
FFFFFFFFFFFFFFFF	7FFFFFFFFFFFFFFF
FFFFFFFFFFFFFFFF	7FFFFFFFFFFFFFFF
8FFFFFFFFFFFFFFF	7FFFFFFFFFFFFFFF
drop table t1;
CREATE TABLE t1 (c0 int);
CREATE TABLE t2 (c0 int);
INSERT INTO t1 VALUES(@@connect_timeout);
INSERT INTO t2 VALUES(@@connect_timeout);
SELECT * FROM t1 JOIN t2 ON t1.c0 = t2.c0 WHERE (t1.c0 <=> @@connect_timeout);
c0	c0
X	X
DROP TABLE t1, t2;
End of 4.1 tests
CREATE TABLE t1 ( 
K2C4 varchar(4) character set latin1 collate latin1_bin NOT NULL default '', 
K4N4 varchar(4) character set latin1 collate latin1_bin NOT NULL default '0000', 
F2I4 int(11) NOT NULL default '0' 
) ENGINE=SequoiaDB DEFAULT CHARSET=latin1;
INSERT INTO t1 VALUES 
('W%RT', '0100',  1), 
('W-RT', '0100', 1), 
('WART', '0100', 1), 
('WART', '0200', 1), 
('WERT', '0100', 2), 
('WORT','0200', 2), 
('WT', '0100', 2), 
('W_RT', '0100', 2), 
('WaRT', '0100', 3), 
('WART', '0300', 3), 
('WRT' , '0400', 3), 
('WURM', '0500', 3), 
('W%T', '0600', 4), 
('WA%T', '0700', 4), 
('WA_T', '0800', 4);
SELECT K2C4, K4N4, F2I4 FROM t1
WHERE  K2C4 = 'WART' AND 
(F2I4 = 2 AND K2C4 = 'WART' OR (F2I4 = 2 OR K4N4 = '0200'));
K2C4	K4N4	F2I4
WART	0200	1
SELECT K2C4, K4N4, F2I4 FROM t1
WHERE  K2C4 = 'WART' AND (K2C4 = 'WART' OR K4N4 = '0200');
K2C4	K4N4	F2I4
WART	0100	1
WART	0200	1
WART	0300	3
DROP TABLE t1;
create table t1 (a int, b int);
create table t2 like t1;
select t1.a from (t1 inner join t2 on t1.a=t2.a) where t2.a=1;
a
select t1.a from ((t1 inner join t2 on t1.a=t2.a)) where t2.a=1;
a
select x.a, y.a, z.a from ( (t1 x inner join t2 y on x.a=y.a) inner join t2 z on y.a=z.a) WHERE x.a=1;
a	a	a
drop table t1,t2;
create table t1 (s1 varchar(5));
insert into t1 values ('Wall');
select min(s1) from t1 group by s1 with rollup;
min(s1)
Wall
Wall
drop table t1;
create table t1 (s1 int) engine=sequoiadb;
insert into t1 values (0);
select avg(distinct s1) from t1 group by s1 with rollup;
avg(distinct s1)
0.0000
0.0000
drop table t1;
create table t1 (s1 int);
insert into t1 values (null),(1);
select avg(s1) as x from t1 group by s1 with rollup;
x
NULL
1.0000
1.0000
select distinct avg(s1) as x from t1 group by s1 with rollup;
ERROR HY000: Incorrect usage of WITH ROLLUP and DISTINCT
drop table t1;
CREATE TABLE t1 (a int);
CREATE TABLE t2 (a int);
INSERT INTO t1 VALUES (1), (2), (3), (4), (5);
INSERT INTO t2 VALUES (2), (4), (6);
SELECT t1.a FROM t1 STRAIGHT_JOIN t2 ON t1.a=t2.a;
a
2
4
DROP TABLE t1,t2;
select x'10' + 0, X'10' + 0, b'10' + 0, B'10' + 0;
x'10' + 0	X'10' + 0	b'10' + 0	B'10' + 0
16	16	2	2
create table t1 (f1 varchar(6) default NULL, f2 int(6) primary key not null);
create table t2 (f3 varchar(5) not null, f4 varchar(5) not null, UNIQUE KEY UKEY (f3,f4));
insert into t1 values (" 2", 2);
insert into t2 values (" 2", " one "),(" 2", " two ");
select * from t1 left join t2 on f1 = f3;
f1	f2	f3	f4
 2	2	 2	 one 
 2	2	 2	 two 
drop table t1,t2;
create table t1 (empnum smallint, grp int);
create table t2 (empnum int, name char(5));
insert into t1 values(1,1);
insert into t2 values(1,'bob');
create view v1 as select * from t2 inner join t1 using (empnum);
select * from v1;
empnum	name	grp
1	bob	1
drop table t1,t2;
drop view v1;
create table t1 (pk int primary key, b int);
create table t2 (pk int primary key, c int);
select pk from t1 inner join t2 using (pk);
pk
drop table t1,t2;
create table t1 (s1 int, s2 char(5), s3 decimal(10));
create view v1 as select s1, s2, 'x' as s3 from t1;
select * from t1 natural join v1;
s1	s2	s3
insert into t1 values (1,'x',5);
select * from t1 natural join v1;
s1	s2	s3
Warnings:
Warning	1292	Truncated incorrect DECIMAL value: 'x'
drop table t1;
drop view v1;
create table t1(a1 int);
create table t2(a2 int);
insert into t1 values(1),(2);
insert into t2 values(1),(2);
create view v2 (c) as select a1 from t1;
select * from t1 natural left join t2;
a1	a2
1	1
1	2
2	1
2	2
select * from t1 natural right join t2;
a2	a1
1	1
1	2
2	1
2	2
select * from v2 natural left join t2;
c	a2
1	1
1	2
2	1
2	2
select * from v2 natural right join t2;
a2	c
1	1
1	2
2	1
2	2
drop table t1, t2;
drop view v2;
create table t1 (a int(10), t1_val int(10));
create table t2 (b int(10), t2_val int(10));
create table t3 (a int(10), b int(10));
insert into t1 values (1,1),(2,2);
insert into t2 values (1,1),(2,2),(3,3);
insert into t3 values (1,1),(2,1),(3,1),(4,1);
select * from t1 natural join t2 natural join t3;
a	b	t1_val	t2_val
1	1	1	1
2	1	2	1
select * from t1 natural join t3 natural join t2;
b	a	t1_val	t2_val
1	1	1	1
1	2	2	1
drop table t1, t2, t3;
DO IFNULL(NULL, NULL);
SELECT CAST(IFNULL(NULL, NULL) AS DECIMAL);
CAST(IFNULL(NULL, NULL) AS DECIMAL)
NULL
SELECT ABS(IFNULL(NULL, NULL));
ABS(IFNULL(NULL, NULL))
NULL
SELECT IFNULL(NULL, NULL);
IFNULL(NULL, NULL)
NULL
SET @OLD_SQL_MODE12595=@@SQL_MODE, @@SQL_MODE='';
Warnings:
Warning	3090	Changing sql mode 'NO_AUTO_CREATE_USER' is deprecated. It will be removed in a future release.
SHOW LOCAL VARIABLES LIKE 'SQL_MODE';
Variable_name	Value
sql_mode	
CREATE TABLE BUG_12595(a varchar(100));
INSERT INTO BUG_12595 VALUES ('hakan%'), ('hakank'), ("ha%an");
SELECT * FROM BUG_12595 WHERE a LIKE 'hakan\%';
a
hakan%
SELECT * FROM BUG_12595 WHERE a LIKE 'hakan*%' ESCAPE '*';
a
hakan%
SELECT * FROM BUG_12595 WHERE a LIKE 'hakan**%' ESCAPE '**';
ERROR HY000: Incorrect arguments to ESCAPE
SELECT * FROM BUG_12595 WHERE a LIKE 'hakan%' ESCAPE '';
a
hakan%
hakank
SELECT * FROM BUG_12595 WHERE a LIKE 'hakan\%' ESCAPE '';
a
SELECT * FROM BUG_12595 WHERE a LIKE 'ha\%an' ESCAPE 0x5c;
a
ha%an
SELECT * FROM BUG_12595 WHERE a LIKE 'ha%%an' ESCAPE '%';
a
ha%an
SELECT * FROM BUG_12595 WHERE a LIKE 'ha\%an' ESCAPE '\\';
a
ha%an
SELECT * FROM BUG_12595 WHERE a LIKE 'ha|%an' ESCAPE '|';
a
ha%an
SET @@SQL_MODE='NO_BACKSLASH_ESCAPES';
SHOW LOCAL VARIABLES LIKE 'SQL_MODE';
Variable_name	Value
sql_mode	NO_BACKSLASH_ESCAPES
SELECT * FROM BUG_12595 WHERE a LIKE 'hakan\%';
a
SELECT * FROM BUG_12595 WHERE a LIKE 'hakan*%' ESCAPE '*';
a
hakan%
SELECT * FROM BUG_12595 WHERE a LIKE 'hakan**%' ESCAPE '**';
ERROR HY000: Incorrect arguments to ESCAPE
SELECT * FROM BUG_12595 WHERE a LIKE 'hakan\%' ESCAPE '\\';
ERROR HY000: Incorrect arguments to ESCAPE
SELECT * FROM BUG_12595 WHERE a LIKE 'hakan%' ESCAPE '';
ERROR HY000: Incorrect arguments to ESCAPE
SELECT * FROM BUG_12595 WHERE a LIKE 'ha\%an' ESCAPE 0x5c;
a
ha%an
SELECT * FROM BUG_12595 WHERE a LIKE 'ha|%an' ESCAPE '|';
a
ha%an
SELECT * FROM BUG_12595 WHERE a LIKE 'hakan\n%' ESCAPE '\n';
ERROR HY000: Incorrect arguments to ESCAPE
SET @@SQL_MODE=@OLD_SQL_MODE12595;
Warnings:
Warning	3090	Changing sql mode 'NO_AUTO_CREATE_USER' is deprecated. It will be removed in a future release.
DROP TABLE BUG_12595;
create table t1 (a char(1));
create table t2 (a char(1));
insert into t1 values ('a'),('b'),('c');
insert into t2 values ('b'),('c'),('d');
select a from t1 natural join t2;
a
b
c
select * from t1 natural join t2 where a = 'b';
a
b
drop table t1, t2;
CREATE TABLE t1 (`id` TINYINT);
CREATE TABLE t2 (`id` TINYINT);
CREATE TABLE t3 (`id` TINYINT);
INSERT INTO t1 VALUES (1),(2),(3);
INSERT INTO t2 VALUES (2);
INSERT INTO t3 VALUES (3);
SELECT t1.id,t3.id FROM t1 JOIN t2 ON (t2.id=t1.id) LEFT JOIN t3 USING (id);
ERROR 23000: Column 'id' in from clause is ambiguous
SELECT t1.id,t3.id FROM t1 JOIN t2 ON (t2.notacolumn=t1.id) LEFT JOIN t3 USING (id);
ERROR 23000: Column 'id' in from clause is ambiguous
SELECT id,t3.id FROM t1 JOIN t2 ON (t2.id=t1.id) LEFT JOIN t3 USING (id);
ERROR 23000: Column 'id' in from clause is ambiguous
SELECT id,t3.id FROM (t1 JOIN t2 ON (t2.id=t1.id)) LEFT JOIN t3 USING (id);
ERROR 23000: Column 'id' in from clause is ambiguous
drop table t1, t2, t3;
create table t1 (a int(10),b int(10));
create table t2 (a int(10),b int(10));
insert into t1 values (1,10),(2,20),(3,30);
insert into t2 values (1,10);
select * from t1 inner join t2 using (A);
a	b	b
1	10	10
select * from t1 inner join t2 using (a);
a	b	b
1	10	10
drop table t1, t2;
create table t1 (a int, c int);
create table t2 (b int);
create table t3 (b int, a int);
create table t4 (c int);
insert into t1 values (1,1);
insert into t2 values (1);
insert into t3 values (1,1);
insert into t4 values (1);
select * from t1 join t2 join t3 on (t2.b = t3.b and t1.a = t3.a);
a	c	b	b	a
1	1	1	1	1
select * from t1, t2 join t3 on (t2.b = t3.b and t1.a = t3.a);
ERROR 42S22: Unknown column 't1.a' in 'on clause'
select * from t1 join t2 join t3 join t4 on (t1.a = t4.c and t2.b = t4.c);
a	c	b	b	a	c
1	1	1	1	1	1
select * from t1 join t2 join t4 using (c);
c	a	b
1	1	1
drop table t1, t2, t3, t4;
create table t1(x int, y int);
create table t2(x int, y int);
create table t3(x int, primary key(x));
insert into t1 values (1, 1), (2, 1), (3, 1), (4, 3), (5, 6), (6, 6);
insert into t2 values (1, 1), (2, 1), (3, 3), (4, 6), (5, 6);
insert into t3 values (1), (2), (3), (4), (5);
select t1.x, t3.x from t1, t2, t3  where t1.x = t2.x and t3.x >= t1.y and t3.x <= t2.y;
x	x
1	1
2	1
3	1
3	2
3	3
4	3
4	4
4	5
drop table t1,t2,t3;
create table t1 (id char(16) not null default '', primary key  (id));
insert into t1 values ('100'),('101'),('102');
create table t2 (id char(16) default null);
insert into t2 values (1);
create view v1 as select t1.id from t1;
create view v2 as select t2.id from t2;
create view v3 as select (t1.id+2) as id from t1 natural left join t2;
select t1.id from t1 left join v2 using (id);
id
100
101
102
select t1.id from v2 right join t1 using (id);
id
100
101
102
select t1.id from t1 left join v3 using (id);
id
100
101
102
select * from t1 left join v2 using (id);
id
100
101
102
select * from v2 right join t1 using (id);
id
100
101
102
select * from t1 left join v3 using (id);
id
100
101
102
select v1.id from v1 left join v2 using (id);
id
100
101
102
select v1.id from v2 right join v1 using (id);
id
100
101
102
select v1.id from v1 left join v3 using (id);
id
100
101
102
select * from v1 left join v2 using (id);
id
100
101
102
select * from v2 right join v1 using (id);
id
100
101
102
select * from v1 left join v3 using (id);
id
100
101
102
drop table t1, t2;
drop view v1, v2, v3;
create table t1 (id int(11) not null default '0');
insert into t1 values (123),(191),(192);
create table t2 (id char(16) character set utf8 not null);
insert into t2 values ('58013'),('58014'),('58015'),('58016');
create table t3 (a_id int(11) not null, b_id char(16) character set utf8);
insert into t3 values (123,null),(123,null),(123,null),(123,null),(123,null),(123,'58013');
select count(*)
from t1 inner join (t3 left join t2 on t2.id = t3.b_id) on t1.id = t3.a_id;
count(*)
6
select count(*)
from t1 inner join (t2 right join t3 on t2.id = t3.b_id) on t1.id = t3.a_id;
count(*)
6
drop table t1,t2,t3;
create table t1 (a int);
create table t2 (b int);
create table t3 (c int);
select * from t1 join t2 join t3 on (t1.a=t3.c);
a	b	c
select * from t1 join t2 left join t3 on (t1.a=t3.c);
a	b	c
select * from t1 join t2 right join t3 on (t1.a=t3.c);
a	b	c
select * from t1 join t2 straight_join t3 on (t1.a=t3.c);
a	b	c
drop table t1, t2 ,t3;
create table t1(f1 int, f2 date);
insert into t1 values(1,'2005-01-01'),(2,'2005-09-01'),(3,'2005-09-30'),
(4,'2005-10-01'),(5,'2005-12-30');
select * from t1 where f2 >= 0            order by f2;
f1	f2
1	2005-01-01
2	2005-09-01
3	2005-09-30
4	2005-10-01
5	2005-12-30
select * from t1 where f2 >= '0000-00-00' order by f2;
f1	f2
1	2005-01-01
2	2005-09-01
3	2005-09-30
4	2005-10-01
5	2005-12-30
Warnings:
Warning	1292	Incorrect date value: '0000-00-00' for column 'f2' at row 1
Warning	1292	Incorrect datetime value: '0000-00-00'
select * from t1 where f2 >= '2005-09-31' order by f2;
f1	f2
4	2005-10-01
5	2005-12-30
Warnings:
Warning	1292	Incorrect datetime value: '2005-09-31'
select * from t1 where f2 >= '2005-09-3a' order by f2;
f1	f2
3	2005-09-30
4	2005-10-01
5	2005-12-30
Warnings:
Warning	1292	Incorrect date value: '2005-09-3a' for column 'f2' at row 1
Warning	1292	Truncated incorrect date value: '2005-09-3a'
select * from t1 where f2 <= '2005-09-31' order by f2;
f1	f2
1	2005-01-01
2	2005-09-01
3	2005-09-30
Warnings:
Warning	1292	Incorrect datetime value: '2005-09-31'
select * from t1 where f2 <= '2005-09-3a' order by f2;
f1	f2
1	2005-01-01
2	2005-09-01
Warnings:
Warning	1292	Incorrect date value: '2005-09-3a' for column 'f2' at row 1
Warning	1292	Truncated incorrect date value: '2005-09-3a'
drop table t1;
create table t1 (f1 int, f2 int);
insert into t1 values (1, 30), (2, 20), (3, 10);
create algorithm=merge view v1 as select f1, f2 from t1;
create algorithm=merge view v2 (f2, f1) as select f1, f2 from t1;
create algorithm=merge view v3 as select t1.f1 as f2, t1.f2 as f1 from t1;
select t1.f1 as x1, f1 from t1 order by t1.f1;
x1	f1
1	1
2	2
3	3
select v1.f1 as x1, f1 from v1 order by v1.f1;
x1	f1
1	1
2	2
3	3
select v2.f1 as x1, f1 from v2 order by v2.f1;
x1	f1
10	10
20	20
30	30
select v3.f1 as x1, f1 from v3 order by v3.f1;
x1	f1
10	10
20	20
30	30
select f1, f2, v1.f1 as x1 from v1 order by v1.f1;
f1	f2	x1
1	30	1
2	20	2
3	10	3
select f1, f2, v2.f1 as x1 from v2 order by v2.f1;
f1	f2	x1
10	3	10
20	2	20
30	1	30
select f1, f2, v3.f1 as x1 from v3 order by v3.f1;
f1	f2	x1
10	3	10
20	2	20
30	1	30
drop table t1;
drop view v1, v2, v3;
CREATE TABLE t1(key_a int4 NOT NULL, optimus varchar(32), PRIMARY KEY(key_a));
CREATE TABLE t2(key_a int4 NOT NULL, prime varchar(32), PRIMARY KEY(key_a));
CREATE table t3(key_a int4 NOT NULL, key_b int4 NOT NULL, foo varchar(32),
PRIMARY KEY(key_a,key_b));
INSERT INTO t1 VALUES (0,'');
INSERT INTO t1 VALUES (1,'i');
INSERT INTO t1 VALUES (2,'j');
INSERT INTO t1 VALUES (3,'k');
INSERT INTO t2 VALUES (1,'r');
INSERT INTO t2 VALUES (2,'s');
INSERT INTO t2 VALUES (3,'t');
INSERT INTO t3 VALUES (1,5,'x');
INSERT INTO t3 VALUES (1,6,'y');
INSERT INTO t3 VALUES (2,5,'xx');
INSERT INTO t3 VALUES (2,6,'yy');
INSERT INTO t3 VALUES (2,7,'zz');
INSERT INTO t3 VALUES (3,5,'xxx');
SELECT t2.key_a,foo 
FROM t1 INNER JOIN t2 ON t1.key_a = t2.key_a
INNER JOIN t3 ON t1.key_a = t3.key_a
WHERE t2.key_a=2 and key_b=5;
key_a	foo
2	xx
SELECT t2.key_a,foo 
FROM t1 INNER JOIN t2 ON t2.key_a = t1.key_a
INNER JOIN t3 ON t1.key_a = t3.key_a
WHERE t2.key_a=2 and key_b=5;
key_a	foo
2	xx
DROP TABLE t1,t2,t3;
create  table t1 (f1 int);
insert into t1 values(1),(2);
create table t2 (f2 int, f3 int, key(f2));
insert into t2 values(1,1),(2,2);
create table t3 (f4 int not null);
insert into t3 values (2),(2),(2);
select f1,(select count(*) from t2,t3 where f2=f1 and f3=f4) as count from t1;
f1	count
1	0
2	3
drop table t1,t2,t3;
create table t1 (f1 int unique);
create table t2 (f2 int unique);
create table t3 (f3 int unique);
insert into t1 values(1),(2);
insert into t2 values(1),(2);
insert into t3 values(1),(NULL);
select * from t3 where f3 is null;
f3
NULL
select t2.f2 from t1 left join t2 on f1=f2 join t3 on f1=f3 where f1=1;
f2
1
drop table t1,t2,t3;
create table t1(f1 char, f2 char not null);
insert into t1 values(null,'a');
create table t2 (f2 char not null);
insert into t2 values('b');
select * from t1 left join t2 on f1=t2.f2 where t1.f2='a';
f1	f2	f2
NULL	a	NULL
drop table t1,t2;
select * from (select * left join t on f1=f2) tt;
ERROR 42000: You have an error in your SQL syntax; check the manual that corresponds to your MySQL server version for the right syntax to use near 'left join t on f1=f2) tt' at line 1
CREATE TABLE t1 (sku int PRIMARY KEY, pr int);
CREATE TABLE t2 (sku int PRIMARY KEY, sppr int, name varchar(255));
INSERT INTO t1 VALUES
(10, 10), (20, 10), (30, 20), (40, 30), (50, 10), (60, 10);
INSERT INTO t2 VALUES 
(10, 10, 'aaa'), (20, 10, 'bbb'), (30, 10, 'ccc'), (40, 20, 'ddd'),
(50, 10, 'eee'), (60, 20, 'fff'), (70, 20, 'ggg'), (80, 30, 'hhh');
SELECT t2.sku, t2.sppr, t2.name, t1.sku, t1.pr
FROM t2, t1 WHERE t2.sku=20 AND (t2.sku=t1.sku OR t2.sppr=t1.sku);
sku	sppr	name	sku	pr
20	10	bbb	20	10
DROP TABLE t1,t2;
SET SQL_MODE='NO_UNSIGNED_SUBTRACTION';
Warnings:
Warning	3090	Changing sql mode 'NO_AUTO_CREATE_USER' is deprecated. It will be removed in a future release.
CREATE TABLE t1 (i TINYINT UNSIGNED NOT NULL);
INSERT t1 SET i = 0;
UPDATE t1 SET i = -1;
Warnings:
Warning	1264	Out of range value for column 'i' at row 1
SELECT * FROM t1;
i
0
UPDATE t1 SET i = CAST(i - 1 AS SIGNED);
Warnings:
Warning	1264	Out of range value for column 'i' at row 1
SELECT * FROM t1;
i
0
UPDATE t1 SET i = i - 1;
Warnings:
Warning	1264	Out of range value for column 'i' at row 1
SELECT * FROM t1;
i
0
DROP TABLE t1;
SET SQL_MODE=default;
create table t1 (a int);
insert into t1 values (0),(1),(2),(3),(4),(5),(6),(7),(8),(9);
create table t2 (a int, b int, c int, e int, primary key(a,b,c));
insert into t2 select A.a, B.a, C.a, C.a from t1 A, t1 B, t1 C;
analyze table t2;
Table	Op	Msg_type	Msg_text
test.t2	analyze	note	The storage engine for the table doesn't support analyze
select 'In next EXPLAIN, B.rows must be exactly 10:' Z;
Z
In next EXPLAIN, B.rows must be exactly 10:
drop table t1, t2;
CREATE TABLE t1 (a int PRIMARY KEY, b int, INDEX(b));
INSERT INTO t1 VALUES (1, 3), (9,4), (7,5), (4,5), (6,2),
(3,1), (5,1), (8,9), (2,2), (0,9);
CREATE TABLE t2 (c int, d int, f int, INDEX(c,f));
INSERT INTO t2 VALUES
(1,0,0), (1,0,1), (2,0,0), (2,0,1), (3,0,0), (4,0,1),
(5,0,0), (5,0,1), (6,0,0), (0,0,1), (7,0,0), (7,0,1),
(0,0,0), (0,0,1), (8,0,0), (8,0,1), (9,0,0), (9,0,1);
DROP TABLE t1, t2;
SELECT 0.9888889889 * 1.011111411911;
0.9888889889 * 1.011111411911
0.9998769417899202067879
prepare stmt from 'select 1 as " a "';
Warnings:
Warning	1466	Leading spaces are removed from name ' a '
execute stmt;
a 
1
CREATE TABLE t1 (a int NOT NULL PRIMARY KEY, b int NOT NULL);
INSERT INTO t1 VALUES (1,1), (2,2), (3,3), (4,4);
CREATE TABLE t2 (c int NOT NULL, INDEX idx(c));
INSERT INTO t2 VALUES
(1), (1), (1), (1), (1), (1), (1), (1),
(2), (2), (2), (2),
(3), (3),
(4);
DROP TABLE t1, t2;
CREATE TABLE t1 (id int NOT NULL PRIMARY KEY, a int);
INSERT INTO t1 VALUES (1,2), (2,NULL), (3,2);
CREATE TABLE t2 (b int, c INT, INDEX idx1(b));
INSERT INTO t2 VALUES (2,1), (3,2);
CREATE TABLE t3 (d int,  e int, INDEX idx1(d));
INSERT INTO t3 VALUES (2,10), (2,20), (1,30), (2,40), (2,50);
SELECT * FROM t1 LEFT JOIN t2 ON t2.b=t1.a INNER JOIN t3 ON t3.d=t1.id
WHERE t1.id=2;
id	a	b	c	d	e
2	NULL	NULL	NULL	2	10
2	NULL	NULL	NULL	2	20
2	NULL	NULL	NULL	2	40
2	NULL	NULL	NULL	2	50
DROP TABLE t1,t2,t3;
CREATE TABLE t1 (pk varchar(10) PRIMARY KEY, fk varchar(16));
CREATE TABLE t2 (pk varchar(16) PRIMARY KEY, fk varchar(10));
INSERT INTO t1 VALUES
('d','dddd'), ('i','iii'), ('a','aa'), ('b','bb'), ('g','gg'), 
('e','eee'), ('c','cccc'), ('h','hhh'), ('j','jjj'), ('f','fff');
INSERT INTO t2 VALUES
('jjj', 'j'), ('cc','c'), ('ccc','c'), ('aaa', 'a'), ('jjjj','j'),
('hhh','h'), ('gg','g'), ('fff','f'), ('ee','e'), ('ffff','f'),
('bbb','b'), ('ff','f'), ('cccc','c'), ('dddd','d'), ('jj','j'),
('aaaa','a'), ('bb','b'), ('eeee','e'), ('aa','a'), ('hh','h');
DROP TABLE t1,t2;
CREATE TABLE t1 (a int, b varchar(20) NOT NULL, PRIMARY KEY(a));
CREATE TABLE t2 (a int, b varchar(20) NOT NULL,
PRIMARY KEY (a), UNIQUE KEY (b));
INSERT INTO t1 VALUES (1,'a'),(2,'b'),(3,'c');
INSERT INTO t2 VALUES (1,'a'),(2,'b'),(3,'c');
DROP TABLE t1,t2;
CREATE TABLE t1(id int PRIMARY KEY, b int, e int);
CREATE TABLE t2(i int, a int, INDEX si(i), INDEX ai(a));
CREATE TABLE t3(a int PRIMARY KEY, c char(4), INDEX ci(c));
INSERT INTO t1 VALUES 
(1,10,19), (2,20,22), (4,41,42), (9,93,95), (7, 77,79),
(6,63,67), (5,55,58), (3,38,39), (8,81,89);
INSERT INTO t2 VALUES
(21,210), (41,410), (82,820), (83,830), (84,840),
(65,650), (51,510), (37,370), (94,940), (76,760),
(22,220), (33,330), (40,400), (95,950), (38,380),
(67,670), (88,880), (57,570), (96,960), (97,970);
INSERT INTO t3 VALUES
(210,'bb'), (950,'ii'), (400,'ab'), (500,'ee'), (220,'gg'),
(440,'gg'), (310,'eg'), (380,'ee'), (840,'bb'), (830,'ff'),
(230,'aa'), (960,'ii'), (410,'aa'), (510,'ee'), (290,'bb'),
(450,'gg'), (320,'dd'), (390,'hh'), (850,'jj'), (860,'ff');
DROP TABLE t1,t2,t3;
CREATE TABLE t1 ( f1 int primary key, f2 int, f3 int, f4 int, f5 int, f6 int, checked_out int);
CREATE TABLE t2 ( f11 int PRIMARY KEY );
INSERT INTO t1 VALUES (1,1,1,0,0,0,0),(2,1,1,3,8,1,0),(3,1,1,4,12,1,0);
INSERT INTO t2 VALUES (62);
SELECT * FROM t1 LEFT JOIN t2 ON f11 = t1.checked_out GROUP BY f1 ORDER BY f2, f3, f4, f5 LIMIT 0, 1;
f1	f2	f3	f4	f5	f6	checked_out	f11
1	1	1	0	0	0	0	NULL
DROP TABLE t1, t2;
DROP TABLE IF EXISTS t1;
CREATE TABLE t1(a int);
INSERT into t1 values (1), (2), (3);
SELECT * FROM t1 LIMIT 2, -1;
ERROR 42000: You have an error in your SQL syntax; check the manual that corresponds to your MySQL server version for the right syntax to use near '-1' at line 1
DROP TABLE t1;
CREATE TABLE t1 (
ID_with_null int NULL,
ID_better int NOT NULL,
INDEX idx1 (ID_with_null),
INDEX idx2 (ID_better)
);
INSERT INTO t1 VALUES (1,1), (2,1), (null,3), (null,3), (null,3), (null,3);
INSERT INTO t1 SELECT * FROM t1 WHERE ID_with_null IS NULL;
INSERT INTO t1 SELECT * FROM t1 WHERE ID_with_null IS NULL;
INSERT INTO t1 SELECT * FROM t1 WHERE ID_with_null IS NULL;
INSERT INTO t1 SELECT * FROM t1 WHERE ID_with_null IS NULL;
INSERT INTO t1 SELECT * FROM t1 WHERE ID_with_null IS NULL;
SELECT COUNT(*) FROM t1 WHERE ID_with_null IS NULL;
COUNT(*)
128
SELECT COUNT(*) FROM t1 WHERE ID_better=1;
COUNT(*)
2
DROP INDEX idx1 ON t1;
CREATE UNIQUE INDEX idx1 ON t1(ID_with_null);
DROP TABLE t1;
CREATE TABLE t1 (
ID1_with_null int NULL,
ID2_with_null int NULL,
ID_better int NOT NULL,
INDEX idx1 (ID1_with_null, ID2_with_null),
INDEX idx2 (ID_better)
);
INSERT INTO t1 VALUES (1,1,1), (2,2,1), (3,null,3), (null,3,3), (null,null,3),
(3,null,3), (null,3,3), (null,null,3), (3,null,3), (null,3,3), (null,null,3);
INSERT INTO t1 SELECT * FROM t1 WHERE ID1_with_null IS NULL;
INSERT INTO t1 SELECT * FROM t1 WHERE ID2_with_null IS NULL;
INSERT INTO t1 SELECT * FROM t1 WHERE ID1_with_null IS NULL;
INSERT INTO t1 SELECT * FROM t1 WHERE ID2_with_null IS NULL;
INSERT INTO t1 SELECT * FROM t1 WHERE ID1_with_null IS NULL;
INSERT INTO t1 SELECT * FROM t1 WHERE ID2_with_null IS NULL;
SELECT COUNT(*) FROM t1 WHERE ID1_with_null IS NULL AND ID2_with_null=3;
COUNT(*)
24
SELECT COUNT(*) FROM t1 WHERE ID1_with_null=3 AND ID2_with_null IS NULL;
COUNT(*)
24
SELECT COUNT(*) FROM t1 WHERE ID1_with_null IS NULL AND ID2_with_null IS NULL;
COUNT(*)
192
SELECT COUNT(*) FROM t1 WHERE ID_better=1;
COUNT(*)
2
DROP TABLE t1;
create table t1 (a bigint unsigned);
insert into t1 values
(if(1, 9223372036854775808, 1)),
(case when 1 then 9223372036854775808 else 1 end),
(coalesce(9223372036854775808, 1));
select * from t1;
a
9223372036854775808
9223372036854775808
9223372036854775808
drop table t1;
create table t1 select
if(1, 9223372036854775808, 1) i,
case when 1 then 9223372036854775808 else 1 end c,
coalesce(9223372036854775808, 1) co;
show create table t1;
Table	Create Table
t1	CREATE TABLE `t1` (
  `i` decimal(19,0) NOT NULL DEFAULT '0',
  `c` decimal(19,0) NOT NULL DEFAULT '0',
  `co` decimal(19,0) NOT NULL DEFAULT '0'
) ENGINE=SEQUOIADB DEFAULT CHARSET=latin1
drop table t1;
select 
if(1, cast(1111111111111111111 as unsigned), 1) i,
case when 1 then cast(1111111111111111111 as unsigned) else 1 end c,
coalesce(cast(1111111111111111111 as unsigned), 1) co;
i	c	co
1111111111111111111	1111111111111111111	1111111111111111111
CREATE TABLE t1 (name varchar(255));
CREATE TABLE t2 (name varchar(255), n int, KEY (name(3)));
INSERT INTO t1 VALUES ('ccc'), ('bb'), ('cc '), ('aa  '), ('aa');
INSERT INTO t2 VALUES ('bb',1), ('aa',2), ('cc   ',3);
INSERT INTO t2 VALUES (concat('cc ', 0x06), 4);
INSERT INTO t2 VALUES ('cc',5), ('bb ',6), ('cc ',7);
SELECT * FROM t2;
name	n
bb	1
aa	2
cc   	3
cc 	4
cc	5
bb 	6
cc 	7
SELECT * FROM t2 ORDER BY name;
name	n
aa	2
bb	1
bb 	6
cc 	4
cc   	3
cc	5
cc 	7
SELECT name, LENGTH(name), n FROM t2 ORDER BY name;
name	LENGTH(name)	n
aa	2	2
bb	2	1
bb 	3	6
cc 	4	4
cc   	5	3
cc	2	5
cc 	3	7
SELECT name, LENGTH(name), n FROM t2 WHERE name='cc ';
name	LENGTH(name)	n
cc 	3	7
SELECT name , LENGTH(name), n FROM t2 WHERE name LIKE 'cc%';
name	LENGTH(name)	n
cc	2	5
cc 	3	7
cc 	4	4
cc   	5	3
SELECT name , LENGTH(name), n FROM t2 WHERE name LIKE 'cc%' ORDER BY name;
name	LENGTH(name)	n
cc 	4	4
cc	2	5
cc 	3	7
cc   	5	3
DROP TABLE t1,t2;
CREATE TABLE t1 (name text);
CREATE TABLE t2 (name text, n int, KEY (name(3)));
INSERT INTO t1 VALUES ('ccc'), ('bb'), ('cc '), ('aa  '), ('aa');
INSERT INTO t2 VALUES ('bb',1), ('aa',2), ('cc   ',3);
INSERT INTO t2 VALUES (concat('cc ', 0x06), 4);
INSERT INTO t2 VALUES ('cc',5), ('bb ',6), ('cc ',7);
SELECT * FROM t2;
name	n
bb	1
aa	2
cc   	3
cc 	4
cc	5
bb 	6
cc 	7
SELECT * FROM t2 ORDER BY name;
name	n
aa	2
bb	1
bb 	6
cc 	4
cc   	3
cc	5
cc 	7
SELECT name, LENGTH(name), n FROM t2 ORDER BY name;
name	LENGTH(name)	n
aa	2	2
bb	2	1
bb 	3	6
cc 	4	4
cc   	5	3
cc	2	5
cc 	3	7
SELECT name, LENGTH(name), n FROM t2 WHERE name='cc ';
name	LENGTH(name)	n
cc 	3	7
SELECT name , LENGTH(name), n FROM t2 WHERE name LIKE 'cc%';
name	LENGTH(name)	n
cc	2	5
cc 	3	7
cc 	4	4
cc   	5	3
SELECT name , LENGTH(name), n FROM t2 WHERE name LIKE 'cc%' ORDER BY name;
name	LENGTH(name)	n
cc 	4	4
cc   	5	3
cc	2	5
cc 	3	7
DROP TABLE t1,t2;
CREATE TABLE t1 (
access_id int NOT NULL default '0',
name varchar(20) default NULL,
rank int NOT NULL default '0',
KEY idx (access_id)
);
CREATE TABLE t2 (
faq_group_id int NOT NULL default '0',
faq_id int NOT NULL default '0',
access_id int default NULL,
UNIQUE KEY idx1 (faq_id),
KEY idx2 (faq_group_id,faq_id)
);
INSERT INTO t1 VALUES 
(1,'Everyone',2),(2,'Help',3),(3,'Technical Support',1),(4,'Chat User',4);
INSERT INTO t2 VALUES
(261,265,1),(490,494,1);
SELECT t2.faq_id 
FROM t1 INNER JOIN t2 IGNORE INDEX (idx1)
ON (t1.access_id = t2.access_id)
LEFT JOIN t2 t
ON (t.faq_group_id = t2.faq_group_id AND
find_in_set(t.access_id, '1,4') < find_in_set(t2.access_id, '1,4'))
WHERE
t2.access_id IN (1,4) AND t.access_id IS NULL AND t2.faq_id in (265);
faq_id
265
SELECT t2.faq_id 
FROM t1 INNER JOIN t2
ON (t1.access_id = t2.access_id)
LEFT JOIN t2 t
ON (t.faq_group_id = t2.faq_group_id AND
find_in_set(t.access_id, '1,4') < find_in_set(t2.access_id, '1,4'))
WHERE
t2.access_id IN (1,4) AND t.access_id IS NULL AND t2.faq_id in (265);
faq_id
265
DROP TABLE t1,t2;
CREATE TABLE t1 (a INT, b INT, KEY inx (b,a));
INSERT INTO t1 VALUES (1,1), (1,2), (1,3), (1,4), (1,5), (1, 6), (1,7);
DROP TABLE t1;
CREATE TABLE t1 (c1 INT, c2 INT);
INSERT INTO t1 VALUES (1,11), (2,22), (2,22);
EXPLAIN SELECT c1 FROM t1 WHERE (SELECT (SELECT (SELECT (SELECT (SELECT (SELECT (SELECT (SELECT (SELECT (SELECT (SELECT (SELECT (SELECT (SELECT (SELECT (SELECT (SELECT (SELECT (SELECT (SELECT (SELECT (SELECT (SELECT (SELECT (SELECT (SELECT (SELECT (SELECT (SELECT COUNT(c2)))))))))))))))))))))))))))))) > 0;
EXPLAIN SELECT c1 FROM t1 WHERE (SELECT (SELECT (SELECT (SELECT (SELECT (SELECT (SELECT (SELECT (SELECT (SELECT (SELECT (SELECT (SELECT (SELECT (SELECT (SELECT (SELECT (SELECT (SELECT (SELECT (SELECT (SELECT (SELECT (SELECT (SELECT (SELECT (SELECT (SELECT (SELECT (SELECT (SELECT (SELECT (SELECT (SELECT (SELECT (SELECT (SELECT (SELECT (SELECT (SELECT (SELECT (SELECT (SELECT (SELECT (SELECT (SELECT (SELECT (SELECT (SELECT (SELECT (SELECT (SELECT (SELECT (SELECT (SELECT (SELECT (SELECT (SELECT (SELECT (SELECT (SELECT (SELECT (SELECT (SELECT COUNT(c2))))))))))))))))))))))))))))))))))))))))))))))))))))))))))))))))) > 0;
ERROR HY000: Too high level of nesting for select
DROP TABLE t1;
SELECT 1 AS ` `;

1
Warnings:
Warning	1474	Name ' ' has become ''
SELECT 1 AS `  `;

1
Warnings:
Warning	1474	Name '  ' has become ''
SELECT 1 AS ` x`;
x
1
Warnings:
Warning	1466	Leading spaces are removed from name ' x'
CREATE VIEW v1 AS SELECT 1 AS ``;
ERROR 42000: Incorrect column name ''
CREATE VIEW v1 AS SELECT 1 AS ` `;
ERROR 42000: Incorrect column name ' '
CREATE VIEW v1 AS SELECT 1 AS `  `;
ERROR 42000: Incorrect column name '  '
CREATE VIEW v1 AS SELECT (SELECT 1 AS `  `);
ERROR 42000: Incorrect column name '  '
CREATE VIEW v1 AS SELECT 1 AS ` x`;
Warnings:
Warning	1466	Leading spaces are removed from name ' x'
SELECT `x` FROM v1;
x
1
ALTER VIEW v1 AS SELECT 1 AS ` `;
ERROR 42000: Incorrect column name ' '
DROP VIEW v1;
select str_to_date('2007-10-09','%Y-%m-%d') between '2007/10/01 00:00:00 GMT'
                                                and '2007/10/20 00:00:00 GMT';
str_to_date('2007-10-09','%Y-%m-%d') between '2007/10/01 00:00:00 GMT'
                                                and '2007/10/20 00:00:00 GMT'
1
Warnings:
Warning	1292	Truncated incorrect datetime value: '2007/10/01 00:00:00 GMT'
Warning	1292	Truncated incorrect datetime value: '2007/10/20 00:00:00 GMT'
select str_to_date('2007-10-09','%Y-%m-%d') > '2007/10/01 00:00:00 GMT-6';
str_to_date('2007-10-09','%Y-%m-%d') > '2007/10/01 00:00:00 GMT-6'
1
Warnings:
Warning	1292	Truncated incorrect date value: '2007/10/01 00:00:00 GMT-6'
select str_to_date('2007-10-09','%Y-%m-%d') <= '2007/10/2000:00:00 GMT-6';
str_to_date('2007-10-09','%Y-%m-%d') <= '2007/10/2000:00:00 GMT-6'
1
Warnings:
Warning	1292	Truncated incorrect date value: '2007/10/2000:00:00 GMT-6'
select str_to_date('2007-10-01','%Y-%m-%d') = '2007-10-1 00:00:00 GMT-6';
str_to_date('2007-10-01','%Y-%m-%d') = '2007-10-1 00:00:00 GMT-6'
1
Warnings:
Warning	1292	Truncated incorrect date value: '2007-10-1 00:00:00 GMT-6'
select str_to_date('2007-10-01','%Y-%m-%d') = '2007-10-01 x00:00:00 GMT-6';
str_to_date('2007-10-01','%Y-%m-%d') = '2007-10-01 x00:00:00 GMT-6'
1
Warnings:
Warning	1292	Truncated incorrect date value: '2007-10-01 x00:00:00 GMT-6'
select str_to_date('2007-10-01','%Y-%m-%d %H:%i:%s') = '2007-10-01 00:00:00 GMT-6';
str_to_date('2007-10-01','%Y-%m-%d %H:%i:%s') = '2007-10-01 00:00:00 GMT-6'
1
Warnings:
Warning	1292	Truncated incorrect datetime value: '2007-10-01 00:00:00 GMT-6'
select str_to_date('2007-10-01','%Y-%m-%d %H:%i:%s') = '2007-10-01 00:x00:00 GMT-6';
str_to_date('2007-10-01','%Y-%m-%d %H:%i:%s') = '2007-10-01 00:x00:00 GMT-6'
1
Warnings:
Warning	1292	Truncated incorrect datetime value: '2007-10-01 00:x00:00 GMT-6'
select str_to_date('2007-10-01','%Y-%m-%d %H:%i:%s') = '2007-10-01 x12:34:56 GMT-6';
str_to_date('2007-10-01','%Y-%m-%d %H:%i:%s') = '2007-10-01 x12:34:56 GMT-6'
1
Warnings:
Warning	1292	Truncated incorrect datetime value: '2007-10-01 x12:34:56 GMT-6'
select str_to_date('2007-10-01 12:34:00','%Y-%m-%d %H:%i:%s') = '2007-10-01 12:34x:56 GMT-6';
str_to_date('2007-10-01 12:34:00','%Y-%m-%d %H:%i:%s') = '2007-10-01 12:34x:56 GMT-6'
1
Warnings:
Warning	1292	Truncated incorrect datetime value: '2007-10-01 12:34x:56 GMT-6'
select str_to_date('2007-10-01 12:34:56','%Y-%m-%d %H:%i:%s') = '2007-10-01 12:34x:56 GMT-6';
str_to_date('2007-10-01 12:34:56','%Y-%m-%d %H:%i:%s') = '2007-10-01 12:34x:56 GMT-6'
0
Warnings:
Warning	1292	Truncated incorrect datetime value: '2007-10-01 12:34x:56 GMT-6'
select str_to_date('2007-10-01 12:34:56','%Y-%m-%d %H:%i:%s') = '2007-10-01 12:34:56';
str_to_date('2007-10-01 12:34:56','%Y-%m-%d %H:%i:%s') = '2007-10-01 12:34:56'
1
select str_to_date('2007-10-01','%Y-%m-%d') = '2007-10-01 12:00:00';
str_to_date('2007-10-01','%Y-%m-%d') = '2007-10-01 12:00:00'
0
select str_to_date('2007-10-01 12','%Y-%m-%d %H') = '2007-10-01 12:00:00';
str_to_date('2007-10-01 12','%Y-%m-%d %H') = '2007-10-01 12:00:00'
1
select str_to_date('2007-10-01 12:34','%Y-%m-%d %H') = '2007-10-01 12:00:00';
str_to_date('2007-10-01 12:34','%Y-%m-%d %H') = '2007-10-01 12:00:00'
1
Warnings:
Warning	1292	Truncated incorrect datetime value: '2007-10-01 12:34'
select str_to_date('2007-02-30 12:34','%Y-%m-%d %H:%i') = '2007-02-30 12:34';
str_to_date('2007-02-30 12:34','%Y-%m-%d %H:%i') = '2007-02-30 12:34'
1
select str_to_date('2007-10-00 12:34','%Y-%m-%d %H:%i') = '2007-10-00 12:34';
str_to_date('2007-10-00 12:34','%Y-%m-%d %H:%i') = '2007-10-00 12:34'
NULL
Warnings:
Warning	1292	Truncated incorrect datetime value: '2007-10-00 12:34'
Warning	1411	Incorrect datetime value: '2007-10-00 12:34' for function str_to_date
select str_to_date('2007-10-00','%Y-%m-%d') between '2007/09/01 00:00:00'
                                                and '2007/10/20 00:00:00';
str_to_date('2007-10-00','%Y-%m-%d') between '2007/09/01 00:00:00'
                                                and '2007/10/20 00:00:00'
NULL
Warnings:
Warning	1411	Incorrect datetime value: '2007-10-00' for function str_to_date
set SQL_MODE=TRADITIONAL;
select str_to_date('2007-10-00 12:34','%Y-%m-%d %H:%i') = '2007-10-00 12:34';
str_to_date('2007-10-00 12:34','%Y-%m-%d %H:%i') = '2007-10-00 12:34'
NULL
Warnings:
Warning	1292	Truncated incorrect datetime value: '2007-10-00 12:34'
Warning	1411	Incorrect datetime value: '2007-10-00 12:34' for function str_to_date
select str_to_date('2007-10-01 12:34','%Y-%m-%d %H:%i') = '2007-10-00 12:34';
str_to_date('2007-10-01 12:34','%Y-%m-%d %H:%i') = '2007-10-00 12:34'
0
Warnings:
Warning	1292	Truncated incorrect datetime value: '2007-10-00 12:34'
select str_to_date('2007-10-00 12:34','%Y-%m-%d %H:%i') = '2007-10-01 12:34';
str_to_date('2007-10-00 12:34','%Y-%m-%d %H:%i') = '2007-10-01 12:34'
NULL
Warnings:
Warning	1411	Incorrect datetime value: '2007-10-00 12:34' for function str_to_date
select str_to_date('2007-10-00','%Y-%m-%d') between '2007/09/01'
                                                and '2007/10/20';
str_to_date('2007-10-00','%Y-%m-%d') between '2007/09/01'
                                                and '2007/10/20'
NULL
Warnings:
Warning	1411	Incorrect datetime value: '2007-10-00' for function str_to_date
set SQL_MODE=DEFAULT;
select str_to_date('2007-10-00','%Y-%m-%d') between '' and '2007/10/20';
str_to_date('2007-10-00','%Y-%m-%d') between '' and '2007/10/20'
NULL
Warnings:
Warning	1411	Incorrect datetime value: '2007-10-00' for function str_to_date
select str_to_date('','%Y-%m-%d') between '2007/10/01' and '2007/10/20';
str_to_date('','%Y-%m-%d') between '2007/10/01' and '2007/10/20'
NULL
Warnings:
Warning	1411	Incorrect datetime value: '' for function str_to_date
select str_to_date('','%Y-%m-%d %H:%i') = '2007-10-01 12:34';
str_to_date('','%Y-%m-%d %H:%i') = '2007-10-01 12:34'
NULL
Warnings:
Warning	1411	Incorrect datetime value: '' for function str_to_date
select str_to_date(NULL,'%Y-%m-%d %H:%i') = '2007-10-01 12:34';
str_to_date(NULL,'%Y-%m-%d %H:%i') = '2007-10-01 12:34'
NULL
select str_to_date('2007-10-00 12:34','%Y-%m-%d %H:%i') = '';
str_to_date('2007-10-00 12:34','%Y-%m-%d %H:%i') = ''
NULL
Warnings:
Warning	1292	Truncated incorrect datetime value: ''
Warning	1411	Incorrect datetime value: '2007-10-00 12:34' for function str_to_date
select str_to_date('1','%Y-%m-%d') = '1';
str_to_date('1','%Y-%m-%d') = '1'
NULL
Warnings:
Warning	1292	Truncated incorrect date value: '1'
Warning	1411	Incorrect datetime value: '1' for function str_to_date
select str_to_date('1','%Y-%m-%d') = '1';
str_to_date('1','%Y-%m-%d') = '1'
NULL
Warnings:
Warning	1292	Truncated incorrect date value: '1'
Warning	1411	Incorrect datetime value: '1' for function str_to_date
select str_to_date('','%Y-%m-%d') = '';
str_to_date('','%Y-%m-%d') = ''
NULL
Warnings:
Warning	1292	Truncated incorrect date value: ''
Warning	1411	Incorrect datetime value: '' for function str_to_date
select str_to_date('1000-01-01','%Y-%m-%d') between '0000-00-00' and NULL;
str_to_date('1000-01-01','%Y-%m-%d') between '0000-00-00' and NULL
0
Warnings:
Warning	1292	Truncated incorrect datetime value: '0000-00-00'
select str_to_date('1000-01-01','%Y-%m-%d') between NULL and '2000-00-00';
str_to_date('1000-01-01','%Y-%m-%d') between NULL and '2000-00-00'
NULL
Warnings:
Warning	1292	Truncated incorrect datetime value: '2000-00-00'
select str_to_date('1000-01-01','%Y-%m-%d') between NULL and NULL;
str_to_date('1000-01-01','%Y-%m-%d') between NULL and NULL
0

#
# Bug#30736: Row Size Too Large Error Creating a Table and
# Inserting Data.
#
DROP TABLE IF EXISTS t1;
DROP TABLE IF EXISTS t2;

CREATE TABLE t1(
c1 DECIMAL(10, 2),
c2 FLOAT);

INSERT INTO t1 VALUES (0, 1), (2, 3), (4, 5);

CREATE TABLE t2(
c3 DECIMAL(10, 2))
SELECT
c1 * c2 AS c3
FROM t1;

SELECT * FROM t1;
c1	c2
0.00	1
2.00	3
4.00	5

SELECT * FROM t2;
c3
0.00
6.00
20.00

DROP TABLE t1;
DROP TABLE t2;

CREATE TABLE t1 (c1 BIGINT NOT NULL);
INSERT INTO t1 (c1) VALUES (1);
SELECT * FROM t1 WHERE c1 > NULL + 1;
c1
DROP TABLE t1;

CREATE TABLE t1 (a VARCHAR(10) NOT NULL PRIMARY KEY);
INSERT INTO t1 (a) VALUES ('foo0'), ('bar0'), ('baz0');
SELECT * FROM t1 WHERE a IN (CONCAT('foo', 0), 'bar');
a
foo0
DROP TABLE t1;
CREATE TABLE t1 (a INT, b INT);
CREATE TABLE t2 (a INT, c INT, KEY(a));
INSERT INTO t1 VALUES (1, 1), (2, 2);
INSERT INTO t2 VALUES (1, 1), (1, 2), (1, 3), (1, 4), (1, 5),
(2, 1), (2, 2), (2, 3), (2, 4), (2, 5),
(3, 1), (3, 2), (3, 3), (3, 4), (3, 5),
(4, 1), (4, 2), (4, 3), (4, 4), (4, 5);
FLUSH STATUS;
SELECT DISTINCT b FROM t1 LEFT JOIN t2 USING(a) WHERE c <= 3;
b
1
2
SHOW STATUS LIKE 'Handler_read%';
Variable_name	Value
Handler_read_first	0
Handler_read_key	0
Handler_read_last	0
Handler_read_next	2
Handler_read_prev	0
Handler_read_rnd	0
Handler_read_rnd_next	6
DROP TABLE t1, t2;
CREATE TABLE t1 (f1 bigint(20) NOT NULL default '0',
f2 int(11) NOT NULL default '0',
f3 bigint(20) NOT NULL default '0',
f4 varchar(255) NOT NULL default '',
PRIMARY KEY (f1),
KEY key1 (f4),
KEY key2 (f2));
CREATE TABLE t2 (f1 int(11) NOT NULL default '0',
f2 enum('A1','A2','A3') NOT NULL default 'A1',
f3 int(11) NOT NULL default '0',
PRIMARY KEY (f1),
KEY key1 (f3));
CREATE TABLE t3 (f1 bigint(20) NOT NULL default '0',
f2 datetime NOT NULL default '1980-01-01 00:00:00',
PRIMARY KEY (f1));
insert into t1 values (1, 1, 1, 'abc');
insert into t1 values (2, 1, 2, 'def');
insert into t1 values (3, 1, 2, 'def');
insert into t2 values (1, 'A1', 1);
insert into t3 values (1, '1980-01-01');
SELECT a.f3, cr.f4, count(*) count
FROM t2 a
STRAIGHT_JOIN t1 cr ON cr.f2 = a.f1
LEFT JOIN
(t1 cr2
JOIN t3 ae2 ON cr2.f3 = ae2.f1
) ON a.f1 = cr2.f2 AND ae2.f2 < now() - INTERVAL 7 DAY AND
cr.f4 = cr2.f4
GROUP BY a.f3, cr.f4;
f3	f4	count
1	abc	1
1	def	2
drop table t1, t2, t3;
CREATE TABLE t1 (a INT KEY, b INT);
INSERT INTO t1 VALUES (1,1), (2,2), (3,3), (4,4);
DROP TABLE t1;
#
# Bug#47019: Assertion failed: 0, file .\rt_mbr.c, line 138 when 
# forcing a spatial index
#
#
# Bug #48291 : crash with row() operator,select into @var, and 
#   subquery returning multiple rows
#
CREATE TABLE t1(a INT);
INSERT INTO t1 VALUES (2),(3);
# Should not crash
SELECT 1 FROM t1 WHERE a <> 1 AND NOT
ROW(1,a) <=> ROW(1,(SELECT 1 FROM t1))
INTO @var0;
ERROR 21000: Subquery returns more than 1 row
DROP TABLE t1;
#
# Bug #48458: simple query tries to allocate enormous amount of
#   memory
#
SET sql_mode = 'NO_ENGINE_SUBSTITUTION';
Warnings:
Warning	3090	Changing sql mode 'NO_AUTO_CREATE_USER' is deprecated. It will be removed in a future release.
CREATE TABLE t1(a INT NOT NULL, b YEAR);
INSERT INTO t1 VALUES ();
Warnings:
Warning	1364	Field 'a' doesn't have a default value
CREATE TABLE t2(c INT);
# Should not err out because of out-of-memory
SELECT 1 FROM t2 JOIN t1 ON 1=1
WHERE a != '1' AND NOT a >= b OR NOT ROW(b,a )<> ROW(a,a);
1
DROP TABLE t1,t2;
SET sql_mode = default;
#
# Bug #49199: Optimizer handles incorrectly: 
# field='const1' AND field='const2' in some cases

CREATE TABLE t1(a DATETIME NOT NULL);
INSERT INTO t1 VALUES('2001-01-01');
SELECT * FROM t1 WHERE a='2001-01-01' AND a='2001-01-01 00:00:00';
a
2001-01-01 00:00:00
Warnings:
Warning	1292	Truncated incorrect time value: '2001-01-01'
Warning	1292	Truncated incorrect time value: '2001-01-01'
DROP TABLE t1;
CREATE TABLE t1(a DATE NOT NULL);
INSERT INTO t1 VALUES('2001-01-01');
SELECT * FROM t1 WHERE a='2001-01-01' AND a='2001-01-01 00:00:00';
a
2001-01-01
DROP TABLE t1;
CREATE TABLE t1(a TIMESTAMP NOT NULL NOT NULL DEFAULT CURRENT_TIMESTAMP ON UPDATE CURRENT_TIMESTAMP);
INSERT INTO t1 VALUES('2001-01-01');
SELECT * FROM t1 WHERE a='2001-01-01' AND a='2001-01-01 00:00:00';
a
2001-01-01 00:00:00
Warnings:
Warning	1292	Truncated incorrect time value: '2001-01-01'
Warning	1292	Truncated incorrect time value: '2001-01-01'
DROP TABLE t1;
CREATE TABLE t1(a DATETIME NOT NULL, b DATE NOT NULL);
INSERT INTO t1 VALUES('2001-01-01', '2001-01-01');
SELECT * FROM t1 WHERE a='2001-01-01' AND a=b AND b='2001-01-01 00:00:00';
a	b
2001-01-01 00:00:00	2001-01-01
Warnings:
Warning	1292	Truncated incorrect time value: '2001-01-01'
Warning	1292	Truncated incorrect time value: '2001-01-01'
DROP TABLE t1;
CREATE TABLE t1(a DATETIME NOT NULL, b VARCHAR(20) NOT NULL);
INSERT INTO t1 VALUES('2001-01-01', '2001-01-01');
SELECT * FROM t1 WHERE a='2001-01-01' AND a=b AND b='2001-01-01 00:00:00';
a	b
Warnings:
Warning	1292	Truncated incorrect time value: '2001-01-01'
Warning	1292	Truncated incorrect time value: '2001-01-01'
SELECT * FROM t1 WHERE a='2001-01-01 00:00:00' AND a=b AND b='2001-01-01';
a	b
2001-01-01 00:00:00	2001-01-01
DROP TABLE t1;
CREATE TABLE t1(a DATETIME NOT NULL, b DATE NOT NULL);
INSERT INTO t1 VALUES('2001-01-01', '2001-01-01');
SELECT x.a, y.a, z.a FROM t1 x 
JOIN t1 y ON x.a=y.a 
JOIN t1 z ON y.a=z.a 
WHERE x.a='2001-01-01' AND z.a='2001-01-01 00:00:00';
a	a	a
2001-01-01 00:00:00	2001-01-01 00:00:00	2001-01-01 00:00:00
Warnings:
Warning	1292	Truncated incorrect time value: '2001-01-01'
Warning	1292	Truncated incorrect time value: '2001-01-01'
Warning	1292	Truncated incorrect time value: '2001-01-01'
Warning	1292	Truncated incorrect time value: '2001-01-01'
Warning	1292	Truncated incorrect time value: '2001-01-01'
Warning	1292	Truncated incorrect time value: '2001-01-01'
DROP TABLE t1;
#
# Bug #49897: crash in ptr_compare when char(0) NOT NULL 
# column is used for ORDER BY
#
SET @old_sort_buffer_size= @@session.sort_buffer_size;
SET @@sort_buffer_size= 40000;
SET sql_mode = 'NO_ENGINE_SUBSTITUTION';
Warnings:
Warning	3090	Changing sql mode 'NO_AUTO_CREATE_USER' is deprecated. It will be removed in a future release.
CREATE TABLE t1(a CHAR(0) NOT NULL);
INSERT INTO t1 VALUES (0), (0), (0);
INSERT INTO t1 SELECT t11.a FROM t1 t11, t1 t12;
INSERT INTO t1 SELECT t11.a FROM t1 t11, t1 t12;
INSERT INTO t1 SELECT t11.a FROM t1 t11, t1 t12;
SELECT a FROM t1 ORDER BY a;
DROP TABLE t1;
CREATE TABLE t1(a CHAR(0) NOT NULL, b CHAR(0) NOT NULL, c int);
INSERT INTO t1 VALUES (0, 0, 0), (0, 0, 2), (0, 0, 1);
INSERT INTO t1 SELECT t11.a, t11.b, t11.c FROM t1 t11, t1 t12;
INSERT INTO t1 SELECT t11.a, t11.b, t11.c FROM t1 t11, t1 t12;
INSERT INTO t1 SELECT t11.a, t11.b, t11.c FROM t1 t11, t1 t12;
SELECT a FROM t1 ORDER BY a LIMIT 5;
a





SELECT * FROM t1 ORDER BY a, b, c LIMIT 5;
a	b	c
		0
		0
		0
		0
		0
SELECT * FROM t1 ORDER BY c, a LIMIT 5;
a	b	c
		0
		0
		0
		0
		0
SET @@sort_buffer_size= @old_sort_buffer_size;
DROP TABLE t1;
SET sql_mode = default;
End of 5.0 tests
create table t1(a INT, KEY (a));
INSERT INTO t1 VALUES (1),(2),(3),(4),(5);
SELECT a FROM t1 ORDER BY a LIMIT 2;
a
1
2
SELECT a FROM t1 ORDER BY a LIMIT 2,4294967296;
a
3
4
5
SELECT a FROM t1 ORDER BY a LIMIT 2,4294967297;
a
3
4
5
DROP TABLE t1;
CREATE TABLE A (date_key date);
CREATE TABLE C (
pk int,
int_nokey int,
int_key int,
date_key date NOT NULL,
date_nokey date,
varchar_key varchar(1)
);
INSERT IGNORE INTO C VALUES 
(1,1,1,'0000-00-00',NULL,NULL),
(1,1,1,'0000-00-00',NULL,NULL);
Warnings:
Warning	1264	Out of range value for column 'date_key' at row 1
Warning	1264	Out of range value for column 'date_key' at row 2
SELECT 1 FROM C WHERE pk > ANY (SELECT 1 FROM C);
1
SELECT COUNT(DISTINCT 1) FROM C 
WHERE date_key = (SELECT 1 FROM A WHERE C.date_key IS NULL) GROUP BY pk;
COUNT(DISTINCT 1)
SELECT date_nokey FROM C 
WHERE int_key IN (SELECT 1 FROM A) 
HAVING date_nokey = '10:41:7' 
ORDER BY date_key;
date_nokey
Warnings:
Warning	1292	Incorrect date value: '10:41:7' for column 'date_nokey' at row 1
DROP TABLE A,C;
CREATE TABLE t1 (a INT NOT NULL, b INT);
INSERT INTO t1 VALUES (1, 1);
SELECT * FROM t1 WHERE (a=a AND a=a) OR b > 2;
a	b
1	1
DROP TABLE t1;
CREATE TABLE t1 (a INT NOT NULL, b INT NOT NULL, c INT NOT NULL);
DROP TABLE t1;
#
# Bug#45266: Uninitialized variable lead to an empty result.
#
drop table if exists A,AA,B,BB;
#end of test for bug#45266
#
# Bug#33546: Slowdown on re-evaluation of constant expressions.
#
CREATE TABLE t1 (a INT);
INSERT INTO t1 VALUES (1), (2), (3), (4), (5), (6), (7), (8), (9), (10);
CREATE TABLE t2 (b INT);
INSERT INTO t2 VALUES (2);
SELECT * FROM t1 WHERE a = 1 + 1;
a
2
SELECT * FROM t1 HAVING a = 1 + 1;
a
2
SELECT * FROM t1, t2 WHERE a = b + (1 + 1);
a	b
4	2
SELECT * FROM t2 LEFT JOIN t1 ON a = b + 1;
b	a
2	3
CREATE FUNCTION f1() RETURNS INT DETERMINISTIC
BEGIN
SET @cnt := @cnt + 1;
RETURN 1;
END;|
SET @cnt := 0;
SELECT * FROM t1 WHERE a = f1();
a
1
SELECT @cnt;
@cnt
2
DROP TABLE t1, t2;
DROP FUNCTION f1;
# End of bug#33546
# 
# BUG#48052: Valgrind warning - uninitialized value in init_read_record()
# 
# Disable Index condition pushdown
SELECT @old_optimizer_switch:=@@optimizer_switch;
@old_optimizer_switch:=@@optimizer_switch
#
CREATE TABLE t1 (
pk int(11) NOT NULL,
i int(11) DEFAULT NULL,
v varchar(1) DEFAULT NULL,
PRIMARY KEY (pk)
);
INSERT INTO t1 VALUES (2,7,'m');
INSERT INTO t1 VALUES (3,9,'m');
SELECT  v
FROM t1
WHERE NOT pk > 0  
HAVING v <= 't' 
ORDER BY pk;
v
# Restore old value for Index condition pushdown
SET SESSION optimizer_switch=@old_optimizer_switch;
DROP TABLE t1;
#
# Bug#49489 Uninitialized cache led to a wrong result.
#
CREATE TABLE t1(c1 DOUBLE(5,4));
INSERT INTO t1 VALUES (9.1234);
SELECT * FROM t1 WHERE c1 < 9.12345;
c1
9.1234
DROP TABLE t1;
# End of test for bug#49489.
#
# Bug #49517: Inconsistent behavior while using 
# NULLable BIGINT and INT columns in comparison
#
CREATE TABLE t1(a BIGINT UNSIGNED NOT NULL, b BIGINT NULL, c INT NULL);
INSERT INTO t1 VALUES(105, NULL, NULL);
SELECT * FROM t1 WHERE b < 102;
a	b	c
SELECT * FROM t1 WHERE c < 102;
a	b	c
SELECT * FROM t1 WHERE 102 < b;
a	b	c
SELECT * FROM t1 WHERE 102 < c;
a	b	c
DROP TABLE t1;
#
# Bug #54459: Assertion failed: param.sort_length, 
# file .\filesort.cc, line 149 (part II)
#
CREATE TABLE t1(a ENUM('') NOT NULL);
INSERT INTO t1 VALUES (), (), ();
SELECT 1 FROM t1 ORDER BY a COLLATE latin1_german2_ci;
1
1
1
1
DROP TABLE t1;
#
# Bug #58422: Incorrect result when OUTER JOIN'ing 
# with an empty table
#
CREATE TABLE t_empty(pk INT PRIMARY KEY, i INT) ENGINE = Sequoiadb;
CREATE TABLE t1(pk INT PRIMARY KEY, i INT) ENGINE = Sequoiadb;
INSERT INTO t1 VALUES (1,1), (2,2), (3,3);
CREATE TABLE t2(pk INT PRIMARY KEY, i INT) ENGINE = Sequoiadb;
INSERT INTO t2 VALUES (1,1), (2,2), (3,3);
SELECT *
FROM 
t1
LEFT OUTER JOIN
(t2 INNER JOIN t_empty ON TRUE)
ON t1.pk=t2.pk
WHERE t2.pk <> 2;
pk	i	pk	i	pk	i
SELECT *
FROM 
t1
LEFT OUTER JOIN
(t2 CROSS JOIN t_empty)
ON t1.pk=t2.pk
WHERE t2.pk <> 2;
pk	i	pk	i	pk	i
SELECT *
FROM 
t1
LEFT OUTER JOIN
(t2 INNER JOIN t_empty ON t_empty.i=t2.i)
ON t1.pk=t2.pk
WHERE t2.pk <> 2;
pk	i	pk	i	pk	i
DROP TABLE t1,t2,t_empty;
End of 5.1 tests
#
# Bug#45227: Lost HAVING clause led to a wrong result.
#
CREATE TABLE `cc` (
`int_nokey` int(11) NOT NULL,
`int_key` int(11) NOT NULL,
`varchar_key` varchar(1) NOT NULL,
`varchar_nokey` varchar(1) NOT NULL,
KEY `int_key` (`int_key`),
KEY `varchar_key` (`varchar_key`)
);
INSERT INTO `cc` VALUES
(0,8,'q','q'),(5,8,'m','m'),(7,3,'j','j'),(1,2,'z','z'),(8,2,'a','a'),(2,6,'',''),(1,8,'e'
,'e'),(8,9,'t','t'),(5,2,'q','q'),(4,6,'b','b'),(5,5,'w','w'),(3,2,'m','m'),(0,4,'x','x'),
(8,9,'',''),(0,6,'w','w'),(4,5,'x','x'),(0,0,'e','e'),(0,0,'e','e'),(2,8,'p','p'),(0,0,'x'
,'x');
SELECT `varchar_nokey` g1  FROM cc  WHERE `int_nokey` AND `int_key`  <= 4
HAVING g1  ORDER  BY `varchar_key` LIMIT  6   ;
g1
DROP TABLE cc;
# End of test#45227
#
# Bug#54515: Crash in opt_range.cc::get_best_group_min_max on 
#            SELECT from VIEW with GROUP BY
#
CREATE TABLE t1 (
col_int_key int DEFAULT NULL,
KEY int_key (col_int_key)
) ;
INSERT INTO t1 VALUES (1),(2);
CREATE VIEW view_t1 AS 
SELECT t1.col_int_key AS col_int_key
FROM t1;
SELECT col_int_key FROM view_t1 GROUP BY col_int_key;
col_int_key
1
2
DROP VIEW view_t1;
DROP TABLE t1;
# End of test BUG#54515
#
# Bug #57203 Assertion `field_length <= 255' failed.
#
SELECT coalesce((avg(distinct (ST_geomfromtext("point(25379 -22010)"))))) 
UNION ALL 
SELECT coalesce((avg(distinct (ST_geomfromtext("point(25379 -22010)")))))
AS foo
;
ERROR HY000: Incorrect arguments to avg(distinct 
CREATE table t1(a text);
INSERT INTO t1 VALUES (''), ('');
SELECT avg(distinct(t1.a)) FROM t1, t1 t2
GROUP BY t2.a ORDER BY t1.a;
avg(distinct(t1.a))
0
DROP TABLE t1;
# End of test BUG#57203
#
# Bug#63020: Function "format"'s 'locale' argument is not considered
#	     when creating a "view'
#
CREATE TABLE t1 (f1 DECIMAL(10,2));
INSERT INTO t1 VALUES (11.67),(17865.3),(12345678.92);
CREATE VIEW view_t1 AS SELECT FORMAT(f1,1,'sk_SK') AS f1 FROM t1;
SHOW CREATE VIEW view_t1;
View	Create View	character_set_client	collation_connection
view_t1	CREATE ALGORITHM=UNDEFINED DEFINER=`root`@`localhost` SQL SECURITY DEFINER VIEW `view_t1` AS select format(`t1`.`f1`,1,'sk_SK') AS `f1` from `t1`	latin1	latin1_swedish_ci
SELECT * FROM view_t1;
f1
11,7
17 865,3
12 345 678,9
DROP TABLE t1;
DROP VIEW view_t1;
# End of test  BUG#63020
#
# Bug #13571700 TINYBLOB NOT NULL, CRASH IN PROTOCOL::NET_STORE_DATA
#
CREATE TABLE t1 (a TINYBLOB NOT NULL);
SELECT a, COUNT(*) FROM t1 WHERE 0;
a	COUNT(*)
NULL	0
DROP TABLE t1;
# End of test BUG#13571700
#
# Bug #18766378: CRASH IN ITEM_SUM_BIT::RESET_FIELD
#
CREATE TABLE t1(b int);
CREATE TABLE t2(a int);
INSERT INTO t1 VALUES (),();
INSERT INTO t2 VALUES (),();
SELECT
( SELECT 1 FROM t1 GROUP BY a
HAVING avg(distinct 1) ORDER BY max(a)
)
FROM  t1, t2
GROUP BY a;
( SELECT 1 FROM t1 GROUP BY a
HAVING avg(distinct 1) ORDER BY max(a)
)
1
DROP TABLE t1,t2;
# End of test BUG#18766378
set optimizer_switch=default
